filename,record number 1,record number 2,alcohol,category,country,description,designation,price,rating,cost per point,region,region coordinates ,region latitude,region longitude,subregion,subregion coordinates ,subregion latitude,subregion longitude,title,url,varietal,vintage,winery
winemag 11201 to 12000,2692,33641,,Red,France,"While the latter years of Lichine family ownership saw a decline in the quality of this estate, new owners have brought about a remarkable renaissance. This 2001 is rich and confident, with layers of wood that balance well with blackberry and currant jelly fruits. This is developing into a serious, impressive wine.",,35,90,0.388888889,Bordeaux,"44.8377890, -0.5791800",44.837789,-0.57918,Margaux,"45.0420350, -0.6775190",45.042035,-0.677519,Château Prieuré-Lichine 2001  Margaux,https://www.winemag.com/buying-guide/chateau-prieure-lichine-2001-red-margaux/,Bordeaux-style Red Blend,2001,Château Prieuré-Lichine
winemag 2401 to 3200,11743,89163,13,Red,France,"This is the second wine of Labégorce, named as a remembrance of the separate Château Labégorce-Zédé that was purchased in 2005. It is a firm wine, with a perfumed character from the judicious wood aging. The tannins are likely to remain part of the character of this wine, working with the black-currant fruit and the final, smoky flavor. Drink from 2017.",Zédé de Labégorce,35,90,0.388888889,Bordeaux,"44.8377890, -0.5791800",44.837789,-0.57918,Margaux,"45.0420350, -0.6775190",45.042035,-0.677519,Château Labégorce Margaux 2011 Zédé de Labégorce  (Margaux),https://www.winemag.com/buying-guide/chateau-labegorce-margaux-2011-zede-de-labegorce-margaux/,Bordeaux-style Red Blend,2011,Château Labégorce Margaux
winemag 3201 to 4000,6843,99723,13,Red,France,"This is a ripe and fruity wine, with juicy black plum and berry fruits that are generous and full in the mouth. It's an impressive effort for the vintage, taking advantage of ripe Merlot to produce a wine that will be ready to drink from 2017.",,35,90,0.388888889,Bordeaux,"44.8377890, -0.5791800",44.837789,-0.57918,Médoc,"44.5568620, -0.0384180",44.556862,-0.038418,Château de Panigon 2013  Médoc,https://www.winemag.com/buying-guide/chateau-de-panigon-2013-medoc/,Bordeaux-style Red Blend,2013,Château de Panigon
winemag 4001 to 4800,1679,110092,13,Red,France,"Named after the gravel (Cailloux) in the vineyard, this rich and concentrated wine has ripe blackberry fruits over the firm tannins. The quality of the vintage shines through, giving the wine a sense of power and longevity. Drink from 2018.",,35,90,0.388888889,Bordeaux,"44.8377890, -0.5791800",44.837789,-0.57918,Médoc,"44.5568620, -0.0384180",44.556862,-0.038418,Château Cailloux de By 2010  Médoc,https://www.winemag.com/buying-guide/chateau-cailloux-by-2010-red-medoc/,Bordeaux-style Red Blend,2010,Château Cailloux de By
winemag 5601 to 6400,5676,145147,13.5,Red,France,"This structured, fruity wine has a core of dense tannins. The firm smokiness from wood marries well with the blackberry fruit and tight acidity. Well balanced, and likely to age well for 4-6 years.",,35,90,0.388888889,Bordeaux,"44.8377890, -0.5791800",44.837789,-0.57918,Médoc,"44.5568620, -0.0384180",44.556862,-0.038418,Château de Panigon 2011  Médoc,https://www.winemag.com/buying-guide/chateau-panigon-2011-red-medoc/,Bordeaux-style Red Blend,2011,Château de Panigon
winemag 8001 to 8800,1910,188315,13,Red,France,"Big and dense, now developing well, the wine shows richness and complex fruit flavors as well as spice and dusty tannins. Licorice and dark chocolate go with damson plum flavors, never losing sight of the final juicy acidity.",,35,90,0.388888889,Bordeaux,"44.8377890, -0.5791800",44.837789,-0.57918,Moulis-en-Médoc,"45.0602370, -0.7675419",45.060237,-0.7675419,Château Dutruch Grand Poujeaux 2006  Moulis-en-Médoc,https://www.winemag.com/buying-guide/chateau-dutruch-grand-poujeaux-2006-red-moulis-en-medoc/,Bordeaux-style Red Blend,2006,Château Dutruch Grand Poujeaux
winemag 8001 to 8800,12776,199181,,Red,France,"An intense and concentrated wine that succeeds well. It has plenty of freshness, but also sufficient firm tannins to offer aging potential. Wood is prominent, but not dominant, finishing with the freshest of berry fruits.",,35,90,0.388888889,Bordeaux,"44.8377890, -0.5791800",44.837789,-0.57918,Pauillac,"45.1995850, -0.7462120",45.199585,-0.746212,Château Batailley 2007  Pauillac,https://www.winemag.com/buying-guide/chateau-batailley-2007-red-pauillac/,Bordeaux-style Red Blend,2007,Château Batailley
winemag 1 to 800,13168,13168,13,Red,France,"This rich Domaines Rodrigues-Lalande wine is already well balanced. It has dense, dusty tannins, rich blackberry flavors and a general sense of comfortable ripeness. Its structure and concentration don't detract from its elegance. Drink this full wine from 2022.",,35,90,0.388888889,Bordeaux,"44.8377890, -0.5791800",44.837789,-0.57918,Pessac-Léognan,"44.8356039, -0.6903529",44.8356039,-0.6903529,Château Pont Saint-Martin 2015  Pessac-Léognan,https://www.winemag.com/buying-guide/chateau-pont-saint-martin-2015-pessac-leognan/,Bordeaux-style Red Blend,2015,Château Pont Saint-Martin
winemag 8001 to 8800,10389,196794,13.5,Red,France,"A solid, ripe wine, with tannins to match the juicy black currants. The structure is flexible, pushing comfortably at the fruit. There is a bright character here, helped by the richness of the flavors.",,35,90,0.388888889,Bordeaux,"44.8377890, -0.5791800",44.837789,-0.57918,Premieres Cotes de Blaye,"45.1268410, -0.6629410",45.126841,-0.662941,Château Cantinot 2005  Premieres Cotes de Blaye,https://www.winemag.com/buying-guide/chateau-cantinot-2005-red-premieres-cotes-blaye/,Bordeaux-style Red Blend,2005,Château Cantinot
winemag 11201 to 12000,2696,33645,,Red,France,"The quality of Faugéres continues to be impressive, none more so than in lesser vintages. This 2002, with its fine structure, balancing tannins, fruit and acidity is dry but has layers of tarry black fruit flavors, leaving a great, fresh, lifted taste in the mouth.",,35,90,0.388888889,Bordeaux,"44.8377890, -0.5791800",44.837789,-0.57918,Saint-Émilion,"44.8943870, -0.1557290",44.894387,-0.155729,Château Faugéres 2002  Saint-Émilion,https://www.winemag.com/buying-guide/chateau-faugeres-2002-red-saint-emilion/,Bordeaux-style Red Blend,2002,Château Faugéres
winemag 2401 to 3200,2524,79944,13,Red,France,"This is the second wine from one of the group of chateaus with Corbin in their names. It is a tight wine, firm with tannins and with a concentrated texture and flavors of over-extraction. That said, the wine will probably develop over time into something serious with a dark, dense aftertaste.",Divin de Corbin,35,90,0.388888889,Bordeaux,"44.8377890, -0.5791800",44.837789,-0.57918,Saint-Émilion,"44.8943870, -0.1557290",44.894387,-0.155729,Château Corbin 2014 Divin de Corbin  (Saint-Émilion),https://www.winemag.com/buying-guide/chateau-corbin-2014-divin-de-corbin-saint-emilion/,Bordeaux-style Red Blend,2014,Château Corbin
winemag 2401 to 3200,2740,80160,13,Red,France,"This is the second wine of Laroze, a property situated on the plateau to the west of Saint-Émilion. This is a softly ripe and perfumed wine with 40% Cabernet Franc in the blend. It is rich, smooth and dense with black fruits and balanced acidity. Drink from 2018.",Lady Laroze,35,90,0.388888889,Bordeaux,"44.8377890, -0.5791800",44.837789,-0.57918,Saint-Émilion,"44.8943870, -0.1557290",44.894387,-0.155729,Château Laroze 2012 Lady Laroze  (Saint-Émilion),https://www.winemag.com/buying-guide/chateau-laroze-2012-lady-laroze-saint-emilion/,Bordeaux-style Red Blend,2012,Château Laroze
winemag 4001 to 4800,14041,122454,13.5,Red,France,"A well constructed, solid wine, this has a fine layer of firm tannins that melds well with the rich black plums and acidity. Even this young, the wine is showing a balanced character, warm and ripe. It will age, so drink from 2018.",,35,90,0.388888889,Bordeaux,"44.8377890, -0.5791800",44.837789,-0.57918,Saint-Émilion,"44.8943870, -0.1557290",44.894387,-0.155729,Château Franc Pipeau 2012  Saint-Émilion,https://www.winemag.com/buying-guide/chateau-franc-pipeau-2012-red-saint-emilion/,Bordeaux-style Red Blend,2012,Château Franc Pipeau
winemag 5601 to 6400,1531,141002,14,Red,France,"Very ripe, powerful and extracted, the wine has a bitter edge, a dark and tannic structure and a dense texture. With its edge of cocoa and layers of wood over the blackberry fruits, it's a wine that will need a while before drinking. Drink from 2016.",Descombes,35,90,0.388888889,Bordeaux,"44.8377890, -0.5791800",44.837789,-0.57918,Saint-Émilion,"44.8943870, -0.1557290",44.894387,-0.155729,Château Franc Pipeau 2010 Descombes  (Saint-Émilion),https://www.winemag.com/buying-guide/chateau-franc-pipeau-2010-descombes-red-saint-emilion/,Bordeaux-style Red Blend,2010,Château Franc Pipeau
winemag 6401 to 7200,15195,170332,14,Red,France,"Concentrated, dark wine. It has serious weight and a dry core of tense tannins. The fruit is floral, full of black currant acidity and black cherry flavors. It will need 2-3 years before it is really drinkable.",,35,90,0.388888889,Bordeaux,"44.8377890, -0.5791800",44.837789,-0.57918,Saint-Émilion,"44.8943870, -0.1557290",44.894387,-0.155729,Château Teyssier 2009  Saint-Émilion,https://www.winemag.com/buying-guide/chateau-teyssier-2009-red-saint-emilion/,Bordeaux-style Red Blend,2009,Château Teyssier
winemag 801 to 1600,4829,206872,13.5,Red,France,"This estate is located in the east of Saint-Émilion. The wine is rich, a powerful statement of Merlot in this ripe vintage. Generous tannins and a light hint of perfume from the 10% Cabernet Franc in the blend give the wine weight. Wood aging mingles with crisp acidity and ripe blackberry fruits. Drink this wine from 2023.",,35,90,0.388888889,Bordeaux,"44.8377890, -0.5791800",44.837789,-0.57918,Saint-Émilion,"44.8943870, -0.1557290",44.894387,-0.155729,Châteay Tour de Capet 2015  Saint-Émilion,https://www.winemag.com/buying-guide/chateay-tour-de-capet-2015-saint-emilion/,Bordeaux-style Red Blend,2015,Châteay Tour de Capet
winemag 801 to 1600,6933,208976,,Red,France,"The 18 months in wood has enhanced the already succulent, exuberant black fruits of this wine. Black-coffee flavors combine with dense tannins and black-plum flavors to produce a superrich, big-hearted wine. Drink from 2024.",,35,90,0.388888889,Bordeaux,"44.8377890, -0.5791800",44.837789,-0.57918,Saint-Émilion,"44.8943870, -0.1557290",44.894387,-0.155729,Château Tour de Pressac 2015  Saint-Émilion,https://www.winemag.com/buying-guide/chateau-tour-de-pressac-2015-saint-emilion/,Bordeaux-style Red Blend,2015,Château Tour de Pressac
winemag 1 to 800,12747,12747,12.5,Red,France,"Ripe, spicy and with a good line of acidity, black-currant fruit and an aromatic character, this is a balanced wine. It is poised, with soft tannins that are well integrated into the wine's structure. Drink from 2020.",Cuvée la Peseille,35,90,0.388888889,Bordeaux,"44.8377890, -0.5791800",44.837789,-0.57918,Saint-Estéphe,"45.2648099, -0.7717824",45.2648099,-0.7717824,Château Martin 2015 Cuvée la Peseille  (Saint-Estéphe),https://www.winemag.com/buying-guide/chateau-martin-2015-cuvee-la-peseille-saint-estephe/,Bordeaux-style Red Blend,2015,Château Martin
winemag 1601 to 2400,14859,76809,13,Red,France,"This small property is in the same ownership as nearby Château Clauzet. The wine, half-and-half Merlot and Cabernet Sauvignon, is dense with bright black-currant flavors under the firm tannins. These and the wood-aging flavors will integrate well, giving a concentrated wine to drink from 2021.",,35,90,0.388888889,Bordeaux,"44.8377890, -0.5791800",44.837789,-0.57918,Saint-Estéphe,"45.2648099, -0.7717824",45.2648099,-0.7717824,Château de Côme 2014  Saint-Estéphe,https://www.winemag.com/buying-guide/chateau-de-come-2014-saint-estephe/,Bordeaux-style Red Blend,2014,Château de Côme
winemag 6401 to 7200,15184,170321,13.5,Red,France,"Full-bodied wine, spiced with nutmeg and toast and give richness by sweet blackberry juice flavors. It is densely structured, rich with great fruit character as well as a powerful drive of rich tannins. Age this wine at least four years and more.",,35,90,0.388888889,Bordeaux,"44.8377890, -0.5791800",44.837789,-0.57918,Saint-Estéphe,"45.2648099, -0.7717824",45.2648099,-0.7717824,Château Bel-Air Ortet 2009  Saint-Estéphe,https://www.winemag.com/buying-guide/chateau-bel-air-ortet-2009-red-saint-estephe/,Bordeaux-style Red Blend,2009,Château Bel-Air Ortet
winemag 801 to 1600,7258,209301,13.5,Red,France,"The 16th-century Scottish baronial-style chateau is surrounded by a 45-acre vineyard that gives structured wines like this. It has the richness of the year although it has not lost the ripe tannins and dark fruits. It needs to age, so drink this firm wine from 2024.",,35,90,0.388888889,Bordeaux,"44.8377890, -0.5791800",44.837789,-0.57918,Saint-Estéphe,"45.2648099, -0.7717824",45.2648099,-0.7717824,Château la Haye 2015  Saint-Estéphe,https://www.winemag.com/buying-guide/chateau-la-haye-2015-saint-estephe/,Bordeaux-style Red Blend,2015,Château la Haye
winemag 5601 to 6400,11176,150647,14.5,Red,France,"Heavy wood aging dominates this rich wine at this stage. That should integrate to leave an almost California ripeness from the 100% Merlot. It has a full and rounded structure, cushioned by generous fruits.",Prima,35,90,0.388888889,Bordeaux,"44.8377890, -0.5791800",44.837789,-0.57918,Cadillac Cotes de Bordeaux,"44.8377890, -0.5791800",44.837789,-0.57918,Château Carignan 2010 Prima  (Cadillac Cotes de Bordeaux),https://www.winemag.com/buying-guide/chateau-carignan-2010-prima-merlot-cadillac-cotes/,Merlot,2010,Château Carignan
winemag 1601 to 2400,5263,67213,13.5,Red,France,"Still with its tannins intact, this is a firm wine with as much dry structure as fruit. It will need time for that structure to soften, giving a wine that will remain firm, which is typical for the vintage. The acidity gives the wine a lift at the end.",,35,90,0.388888889,Bordeaux,"44.8377890, -0.5791800",44.837789,-0.57918,Saint-Émilion,"44.8943870, -0.1557290",44.894387,-0.155729,Château Haut-Cardinal 2011  Saint-Émilion,https://www.winemag.com/buying-guide/chateau-haut-cardinal-2011-saint-emilion/,Merlot,2011,Château Haut-Cardinal
winemag 4801 to 5600,14671,138564,,Red,France,"Dry, with dusty tannins and ripe fruit, this is a wine with considerable potential. The berry fruits have a balanced, juicy element, fine acidity and a strong texture. The wine is rich and full, while remaining fresh. Drink from 2015.",,36,90,0.4,Bordeaux,"44.8377890, -0.5791800",44.837789,-0.57918,Castillon Cotes de Bordeaux,"44.8533003, -0.0436106",44.8533003,-0.0436106,Domaine de l'A 2011  Castillon Cotes de Bordeaux,https://www.winemag.com/buying-guide/domaine-2011-red-castillon-cotes/,Bordeaux-style Red Blend,2011,Domaine de l'A
winemag 3201 to 4000,7112,99992,13.5,Red,France,"For a Lalande de Pomerol this wine has a high proportion (30%) of Cabernet Franc, giving a structure that shapes the ripe Merlot. It's juicy with black plums and has a core of dry tannins. Drink from 2018.",,36,90,0.4,Bordeaux,"44.8377890, -0.5791800",44.837789,-0.57918,Lalande de Pomerol,"44.9558210, -0.2108580",44.955821,-0.210858,Château Tournefeuille 2013  Lalande de Pomerol,https://www.winemag.com/buying-guide/chateau-tournefeuille-2013-lalande-de-pomerol/,Bordeaux-style Red Blend,2013,Château Tournefeuille
winemag 3201 to 4000,7170,100050,13,Red,France,"This small estate is wedged between some of the classed growths of Pauillac. Firm and structured, the wine is solid with tannins and backed with concentrated blackberry fruits. The 60% Cabernet in the blend gives great acidity as well as the tannins. These two elements will allow the wine to age, so drink from 2018.",,36,90,0.4,Bordeaux,"44.8377890, -0.5791800",44.837789,-0.57918,Pauillac,"45.1995850, -0.7462120",45.199585,-0.746212,Domaine de Saint-Guirons 2011  Pauillac,https://www.winemag.com/buying-guide/domaine-de-saint-guirons-2011-pauillac/,Bordeaux-style Red Blend,2011,Domaine de Saint-Guirons
winemag 2401 to 3200,11742,89162,13.5,Red,France,"The vineyard surrounds a 14th century castle, built by the English. The wine from organically grown grapes, is rich and full. Still with some tannins while also with rich black fruits, it is structured, ripe and generous. The wine is ready to drink, although keeping it until 2017 will make it even better.",,36,90,0.4,Bordeaux,"44.8377890, -0.5791800",44.837789,-0.57918,Puisseguin Saint-Émilion,"44.9250990, -0.0743070",44.925099,-0.074307,Château Langlais 2010  Puisseguin Saint-Émilion,https://www.winemag.com/buying-guide/chateau-langlais-2010-puisseguin-saint-emilion/,Bordeaux-style Red Blend,2010,Château Langlais
winemag 1601 to 2400,14827,76777,13.5,Red,France,"This is a delicious wine with its ripe fruits and soft tannins. It has a touch of spice, as well as bright acidity along with a touch of smokiness from the wood aging. Rich and generous, it will mature quickly. Drink from 2019.",,36,90,0.4,Bordeaux,"44.8377890, -0.5791800",44.837789,-0.57918,Saint-Émilion,"44.8943870, -0.1557290",44.894387,-0.155729,Château Teyssier 2014  Saint-Émilion,https://www.winemag.com/buying-guide/chateau-teyssier-2014-saint-emilion/,Bordeaux-style Red Blend,2014,Château Teyssier
winemag 4001 to 4800,1485,109898,13.5,Red,France,"In this smooth and rich wine, tannins glide across the palate leaving ripe fruit in their wake. It is concentrated, full of berry fruits and juicy blackcurrants. Full and fruity, this delicious wine will develop quickly. Drink from 2017.",,36,90,0.4,Bordeaux,"44.8377890, -0.5791800",44.837789,-0.57918,Saint-Émilion,"44.8943870, -0.1557290",44.894387,-0.155729,Château Peymouton 2012  Saint-Émilion,https://www.winemag.com/buying-guide/chateau-peymouton-2012-red-saint-emilion/,Bordeaux-style Red Blend,2012,Château Peymouton
winemag 801 to 1600,5005,207048,14,Red,France,"Spicy and toasty from the wood aging, this wine is ripe and dense. It has enough juicy black fruits to balance the serious amount of wood, at least in the future. Wait for this concentrated wine with its good potential to develop over the next few years. Drink from 2021.",Grand Héritage,36,90,0.4,Bordeaux,"44.8377890, -0.5791800",44.837789,-0.57918,Lussac Saint-Émilion,"44.9490330, -0.0962630",44.949033,-0.096263,Château des Landes 2015 Grand Héritage  (Lussac Saint-Émilion),https://www.winemag.com/buying-guide/chateau-des-landes-2015-grand-heritage-lussac-saint-emilion/,Merlot,2015,Château des Landes
winemag 1601 to 2400,4922,66872,14,Red,France,"This is a ripe wine, already approaching maturity. It has rich tannins and a generous structure. The wine is full with plenty of black fruits and balanced acidity. Black currants and spices mingle easily. The wine will be ready to drink from 2018.",,37,90,0.411111111,Bordeaux,"44.8377890, -0.5791800",44.837789,-0.57918,Castillon Cotes de Bordeaux,"44.8533003, -0.0436106",44.8533003,-0.0436106,Château Moya 2014  Castillon Cotes de Bordeaux,https://www.winemag.com/buying-guide/chateau-moya-2014-castillon-cotes-de-bordeaux/,Bordeaux-style Red Blend,2014,Château Moya
winemag 8801 to 9600,1859,218840,13,Red,France,"A richly Merlot wine, soft, ripe, packed with black jelly flavors, sweet acidity and generous balanced tannins. The flavors come together in a balanced, rich way. An attractive wine, ready to drink now.",,37,90,0.411111111,Bordeaux,"44.8377890, -0.5791800",44.837789,-0.57918,Lalande de Pomerol,"44.9558210, -0.2108580",44.955821,-0.210858,Château Pavillon Bel-Air 2006  Lalande de Pomerol,https://www.winemag.com/buying-guide/chateau-pavillon-bel-air-2006-red-lalande-pomerol/,Bordeaux-style Red Blend,2006,Château Pavillon Bel-Air
winemag 11201 to 12000,2736,33685,,Red,France,"The style of Cantenac-Brown is generally softer, richer than other Margaux, and this 2001 is no exception. It has a perfumed character, which has sweet, meaty flavors over ripe fruit. It has exotic spices, layered with dark wood and red fruits. To finish, there are dark tarry flavors and a blackberry-jelly freshness.",,37,90,0.411111111,Bordeaux,"44.8377890, -0.5791800",44.837789,-0.57918,Margaux,"45.0420350, -0.6775190",45.042035,-0.677519,Château Cantenac Brown 2001  Margaux,https://www.winemag.com/buying-guide/chateau-cantenac-brown-2001-red-margaux/,Bordeaux-style Red Blend,2001,Château Cantenac Brown
winemag 5601 to 6400,13971,153442,14,Red,France,"Ripe plum, dark coffee and spice flavors join the firm tannins in this intense wine. It has a strong structure that needs to soften to allow the juicy black-currant flavor to surface. Give it 4-5 years.",,37,90,0.411111111,Bordeaux,"44.8377890, -0.5791800",44.837789,-0.57918,Médoc,"44.5568620, -0.0384180",44.556862,-0.038418,Château Tour Seran 2010  Médoc,https://www.winemag.com/buying-guide/chateau-tour-seran-2010-red-medoc/,Bordeaux-style Red Blend,2010,Château Tour Seran
winemag 1601 to 2400,14605,76555,14.5,Red,France,"This is the second wine of Château de Pressac, situated to the east of the town of Saint-Emilion. With ripe black-plum fruit and finely integrated sophisticated tannins, this is a rich wine that wears its alcohol easily. The juicy acidity at the end keeps the wine crisp and fruity. Drink from 2022.",,37,90,0.411111111,Bordeaux,"44.8377890, -0.5791800",44.837789,-0.57918,Saint-Émilion,"44.8943870, -0.1557290",44.894387,-0.155729,Château Tour de Pressac 2014  Saint-Émilion,https://www.winemag.com/buying-guide/chateau-tour-de-pressac-2014-saint-emilion/,Bordeaux-style Red Blend,2014,Château Tour de Pressac
winemag 1 to 800,4530,4530,13.5,Red,France,"This 30-acre vineyard, 70% Merlot, has produced a balanced, stylish wine. Touches of bitter coffee come from the 15 months in wood, but the main thrust of this developing wine is the ripe black-currant fruitiness. Drink from 2021.",,38,90,0.422222222,Bordeaux,"44.8377890, -0.5791800",44.837789,-0.57918,Puisseguin Saint-Émilion,"44.9250990, -0.0743070",44.925099,-0.074307,Château Langlais 2015  Puisseguin Saint-Émilion,https://www.winemag.com/buying-guide/chateau-langlais-2015-puisseguin-saint-emilion/,Bordeaux-style Red Blend,2015,Château Langlais
winemag 4001 to 4800,13966,122379,13,Red,France,"Rich, spicy and perfumed, this delicious wine is developing well and also has aging potential. It is packed with berry and plum fruits that parade with acidity and tannins that act as a support. It's still dense and the balanced fruit and tannins will allow it to age. Drink from 2018.",,38,90,0.422222222,Bordeaux,"44.8377890, -0.5791800",44.837789,-0.57918,Saint-Émilion,"44.8943870, -0.1557290",44.894387,-0.155729,Château Ambe Tour Pourret 2011  Saint-Émilion,https://www.winemag.com/buying-guide/chateau-ambe-tour-pourret-2011-red-saint-emilion/,Bordeaux-style Red Blend,2011,Château Ambe Tour Pourret
winemag 4001 to 4800,7997,116410,12.5,Red,France,"This sophisticated, wood-aged wine is perfumed with polished wood and black currant. The palate offers tight tannins and ample acidity. Although it is already ripe and fruity, the structure of the wine promises successful aging; drink from 2017.",Arnozan by Château Léo de Prades Réserve des Chartrons,38,90,0.422222222,Bordeaux,"44.8377890, -0.5791800",44.837789,-0.57918,Saint-Estéphe,"45.2648099, -0.7717824",45.2648099,-0.7717824,Producta Vignobles 2011 Arnozan by Château Léo de Prades Réserve des Chartrons  (Saint-Estéphe),https://www.winemag.com/buying-guide/producta-vignobles-2011-arnozan-by-chateau-leo-prades-reserve-chartrons-red-saint-estephe/,Bordeaux-style Red Blend,2011,Producta Vignobles
winemag 1 to 800,12826,12826,14,Red,France,"This fruity, juicy wine offers some well-structured tannins. Aged in wood for 18 months, it is ripe, concentrated and full of black-currant and blueberry flavors. It is a wine with potential; drink from 2022.",,39,90,0.433333333,Bordeaux,"44.8377890, -0.5791800",44.837789,-0.57918,Lussac Saint-Émilion,"44.9490330, -0.0962630",44.949033,-0.096263,Château la Claymore 2016  Lussac Saint-Émilion,https://www.winemag.com/buying-guide/chateau-la-claymore-2016-lussac-saint-emilion/,Bordeaux-style Red Blend,2016,Château la Claymore
winemag 801 to 1600,10704,212747,13,Red,France,"This wine is full of crisp fruit, perfumed wood and red-berry acidity. Perfumed Cabernet Franc gives extra complexity to the juicy Merlot to offer a balanced wine that will be ready from 2019",,39,90,0.433333333,Bordeaux,"44.8377890, -0.5791800",44.837789,-0.57918,Pomerol,"45.2106560, 2.7008169",45.210656,2.7008169,Château Gouprie 2014  Pomerol,https://www.winemag.com/buying-guide/chateau-gouprie-2014-pomerol-279118/,Bordeaux-style Red Blend,2014,Château Gouprie
winemag 1 to 800,3001,3001,15,Red,France,"The heavy bottle tells you this is meant to be a statement wine. It comes from the vineyard's best parcels, which have produced a richly endowed wine, dark and concentrated, powered by the tannins. It needs to age and will not be ready before 2022.",Absolu,40,90,0.444444444,Bordeaux,"44.8377890, -0.5791800",44.837789,-0.57918,Blaye Cotes de Bordeaux,"44.8377890, -0.5791800",44.837789,-0.57918,Château Bourdieu 2016 Absolu  (Blaye Cotes de Bordeaux),https://www.winemag.com/buying-guide/chateau-bourdieu-2016-absolu-blaye-cotes-de-bordeaux/,Bordeaux-style Red Blend,2016,Château Bourdieu
