filename,record number 1,record number 2,alcohol,category,country,description,designation,price,rating,cost per point,region / state,subregion,subregion lat lon,subregion lat,subregion lon,subsubregion,subsubregion lat lon,subsubregion lat,subsubregion lon,title,url,varietal,vintage,winery
winemag 801 to 1600,240,202283,14.5,White,US,"This combines grapes from the Martinelli family's Charles Ranch Vineyard in Fort Ross-Seaview with grapes from Platt Vineyard, a site long sourced by Ramey overlooking the Pacific Ocean near Freestone-the producer's coolest site. It melds exotic ginger with apple skin, melon rind and bright focused acidity that remains fresh, succulent and lingering.",,42,95, $0.44 ,California,Sonoma,"38.2918590, -122.4580356",38.291859,-122.4580356,Sonoma Coast,"38.5779555, -122.9888319",38.5779555,-122.9888319,95pointsRamey 2015 Chardonnay (Sonoma Coast)Editors' Choice,https://www.winemag.com/buying-guide/ramey-2015-chardonnay-sonoma-coast/,Chardonnay,2015,Ramey
winemag 801 to 1600,241,202284,14.1,White,US,"This wine opens in muted aromatics that slowly blossom into a shaker of oystershell and saline, a salty and bold character of slate and stone that gives it texture and complexity. Green apple, quince and white flower mingle on the expansive ethereal palate within a medium-bodied balanced context of concentration.",Hyde Vineyard,80,95, $0.84 ,California,Carneros,"38.2630002, -122.3415289",38.2630002,-122.3415289,Carneros,"38.2630002, -122.3415289",38.2630002,-122.3415289,Kistler 2015 Hyde Vineyard Chardonnay (Carneros),https://www.winemag.com/buying-guide/kistler-2015-hyde-vineyard-chardonnay-carneros/,Chardonnay,2015,Kistler
winemag 801 to 1600,463,202506,14.6,White,US,"From a site farmed by the Dutton family, this wine is beautifully aromatic in brioche and honey apple, with light toasted oak playing a supporting part. An underlying richness presents as expansive and fleshy on the robust palate, with high-toned offerings of peach and Gravenstein apple.",Three Jacks Vineyard,65,95, $0.68 ,California,Sonoma,"38.2918590, -122.4580356",38.291859,-122.4580356,Green Valley,"34.6216542, -118.4139702",34.6216542,-118.4139702,Hartford Court 2015 Three Jacks Vineyard Chardonnay (Green Valley),https://www.winemag.com/buying-guide/hartford-court-2015-three-jacks-vineyard-chardonnay-green-valley/,Chardonnay,2015,Hartford Court
winemag 801 to 1600,464,202507,14.1,White,US,"With an underlying richness, this medium-bodied white never forgets about its throughput of acidity, allowing for an undeniable crispness on the palate. Floral on the nose in apple and orange blossom, it shows a stony character that speaks to mineral components like oystershell and rock.",McCrea Vineyard,80,95, $0.84 ,California,Sonoma,"38.2918590, -122.4580356",38.291859,-122.4580356,Sonoma Mountain,"38.2918590, -122.4580356",38.291859,-122.4580356,Kistler 2015 McCrea Vineyard Chardonnay (Sonoma Mountain),https://www.winemag.com/buying-guide/kistler-2015-mccrea-vineyard-chardonnay-sonoma-mountain/,Chardonnay,2015,Kistler
winemag 801 to 1600,468,202511,14.1,White,US,"From one of the older blocks of the famous vineyard, once looked after by this winemaker, this wine is beautifully golden in color with a reduced, salty nose of caramelized pretzel. Robustly built, it shows fleshy, lush layers of honey and tropical richness.",Hudson Vineyard,80,95, $0.84 ,California,Carneros,"38.2630002, -122.3415289",38.2630002,-122.3415289,Carneros,"38.2630002, -122.3415289",38.2630002,-122.3415289,Kistler 2015 Hudson Vineyard Chardonnay (Carneros),https://www.winemag.com/buying-guide/kistler-2015-hudson-vineyard-chardonnay-carneros/,Chardonnay,2015,Kistler
winemag 801 to 1600,2448,204491,14.1,White,US,"Exposed to the coast, this crisp white is racy with flavors of salty pretzel and apple skin. It offers impressive weight and viscosity interwoven with juicy acidity, allowing it to stay fresh and focused in the glass. Freshly squeezed lemon shows on the nose and palate, with a touch of brine and supportive oak.",Seascape Vineyard,70,95, $0.74 ,California,Sonoma,"38.2918590, -122.4580356",38.291859,-122.4580356,Sonoma Coast,"38.5779555, -122.9888319",38.5779555,-122.9888319,Hartford Court 2015 Seascape Vineyard Chardonnay (Sonoma Coast),https://www.winemag.com/buying-guide/hartford-court-2015-seascape-vineyard-chardonnay-sonoma-coast/,Chardonnay,2015,Hartford Court
winemag 801 to 1600,2450,204493,13.9,White,US,This wine strikes supple fruit tones against broad minerality. Meyer lemon and tangerine flavors are complemented by salty stone and butter. Bright acidity carries the palate as a lovely note of orange blossom persists.,Rochioli-Allen Vineyards,60,95, $0.63 ,California,Sonoma,"38.2918590, -122.4580356",38.291859,-122.4580356,Russian River Valley,"38.9119799, -123.0537083",38.9119799,-123.0537083,Gary Farrell 2015 Rochioli-Allen Vineyards Chardonnay (Russian River Valley),https://www.winemag.com/buying-guide/gary-farrell-2015-rochioli-allen-vineyards-chardonnay-russian-river-valley/,Chardonnay,2015,Gary Farrell
winemag 801 to 1600,2461,204504,13.6,White,US,"This wine opens with a tropical lushness on the nose before settling onto a tangy palate of citrus and star fruit. It shows balance and grace, with tones of stone and brine.",Olivet Lane Vineyard,45,95, $0.47 ,California,Sonoma,"38.2918590, -122.4580356",38.291859,-122.4580356,Russian River Valley,"38.9119799, -123.0537083",38.9119799,-123.0537083,Gary Farrell 2015 Olivet Lane Vineyard Chardonnay (Russian River Valley),https://www.winemag.com/buying-guide/gary-farrell-2015-olivet-lane-vineyard-chardonnay-russian-river-valley/,Chardonnay,2015,Gary Farrell
winemag 801 to 1600,4431,206474,12.5,White,US,"Lemon blossoms, crushed chalk, sea salt, sandalwood smoke and lime pith swirl together into an extremely inviting, compelling and truly Burgundian nose on this bottling by Dave Potter. The palate is grippy and layered with texture and flavors of lemon rind, crushed nuts, judicious oak and the slightest pop of crème brûlée on the finish. Drink now-2030.",Bien Nacido Vineyard,45,95, $0.47 ,California,Central Coast,"35.6368759, -120.6545022",35.6368759,-120.6545022,Santa Maria Valley,"34.9530337, -120.4357191",34.9530337,-120.4357191,Potek 2015 Bien Nacido Vineyard Chardonnay (Santa Maria Valley),https://www.winemag.com/buying-guide/potek-2015-bien-nacido-vineyard-chardonnay-santa-maria-valley/,Chardonnay,2015,Potek
winemag 801 to 1600,4435,206478,14,White,US,"Salt rock and tart green-apple tones combine effortlessly to showcase a sublime texture with considerable length and depth. A touch of butterscotch graces the finish, but it's otherwise all about freshness in lemon and lime flavors, with exotic elements of lemongrass and ginger.",Dutton Ranch Walker Hill Vineyard,50,95, $0.53 ,California,Sonoma,"38.2918590, -122.4580356",38.291859,-122.4580356,Green Valley,"34.6216542, -118.4139702",34.6216542,-118.4139702,Dutton-Goldfield 2015 Dutton Ranch Walker Hill Vineyard Chardonnay (Green Valley),https://www.winemag.com/buying-guide/dutton-goldfield-2015-dutton-ranch-walker-hill-vineyard-chardonnay-green-valley/,Chardonnay,2015,Dutton-Goldfield
winemag 801 to 1600,4436,206479,13.4,White,US,"Very tightly wound on the nose, this impressive bottling by Matt Dees of Jonata fame starts with fresh and seabreeze-like aromas, from lime zest and pink lemonade to wet slate and cool steel. The sip is energetic and racy like a classic Chablis, showing lemon balm, honeysuckle and well integrated oak across a texturally compelling platform.",The Vanguard,55,95, $0.58 ,California,Central Coast,"35.6368759, -120.6545022",35.6368759,-120.6545022,Santa Barbara County,"34.4208305, -119.6981901",34.4208305,-119.6981901,The Hilt 2015 The Vanguard Chardonnay (Santa Barbara County),https://www.winemag.com/buying-guide/the-hilt-2015-the-vanguard-chardonnay-santa-barbara-county/,Chardonnay,2015,The Hilt
winemag 801 to 1600,4491,206534,13.4,White,US,"Soft and mellow on the nose, with aromas of lemon cream, Meyer lemon pith, sea shells and a stroke of wood, this is a bottle to lay down and drink over the decades to come. The fresh, citrusy and layered palate focuses on bright acidity and textural tightness, making a perfect pairing for shellfish and white fish. Drink now through 2035.",The Old Guard,55,95, $0.58 ,California,Central Coast,"35.6368759, -120.6545022",35.6368759,-120.6545022,Santa Barbara County,"34.4208305, -119.6981901",34.4208305,-119.6981901,95pointsThe Hilt 2015 The Old Guard Chardonnay (Santa Barbara County)Cellar Selection,https://www.winemag.com/buying-guide/the-hilt-2015-the-old-guard-chardonnay-santa-barbara-county/,Chardonnay,2015,The Hilt
winemag 801 to 1600,8079,210122,14.3,White,US,"Pear and melon meld with briny minerality on the palate of this well-integrated, mildly ripe wine. Lasting acidity supports spicy flavors of nutmeg, allspice and anise. The texture is harmonious and focused.",Drake Estate Vineyard,65,95, $0.68 ,California,Sonoma,"38.2918590, -122.4580356",38.291859,-122.4580356,Russian River Valley,"38.9119799, -123.0537083",38.9119799,-123.0537083,Williams Selyem 2015 Drake Estate Vineyard Chardonnay (Russian River Valley),https://www.winemag.com/buying-guide/williams-selyem-2015-drake-estate-vineyard-chardonnay-russian-river-valley/,Chardonnay,2015,Williams Selyem
winemag 801 to 1600,8101,210144,13.5,White,US,"What a beautiful wine from the famed site still farmed by the Rochioli family. This is fresh, fruity and layered in citrus and Gravenstein apple, with interweaving acidity through flavors of lemon and lime. It has a stony quality that speaks to underlying minerality and a jolt of briny, salty air.",Rochioli Vineyard,60,95, $0.63 ,California,Sonoma,"38.2918590, -122.4580356",38.291859,-122.4580356,Russian River Valley,"38.9119799, -123.0537083",38.9119799,-123.0537083,Gary Farrell 2015 Rochioli Vineyard Chardonnay (Russian River Valley),https://www.winemag.com/buying-guide/gary-farrell-2015-rochioli-vineyard-chardonnay-russian-river-valley/,Chardonnay,2015,Gary Farrell
winemag 801 to 1600,8111,210154,14.8,White,US,"This is a robust white, exhibiting an exotic nose of spicy nutmeg and lemongrass. Fully oaked, it presents ripeness and concentration, a sign of its youthful vigor and the density of the vintage. Lemony acidity provides freshness against the bolder landscape of ripe apple and melon.",Allen Vineyard,65,95, $0.68 ,California,Sonoma,"38.2918590, -122.4580356",38.291859,-122.4580356,Russian River Valley,"38.9119799, -123.0537083",38.9119799,-123.0537083,Williams Selyem 2015 Allen Vineyard Chardonnay (Russian River Valley),https://www.winemag.com/buying-guide/williams-selyem-2015-allen-vineyard-chardonnay-russian-river-valley/,Chardonnay,2015,Williams Selyem
winemag 801 to 1600,9930,211973,14.6,White,US,"Beautifully oaky and unctuously voluptuous, this is from a tremendously farmed site in the throes of the Petaluma Gap. Richly layered in tones of butterscotch and brioche, its length and breadth are punctuated by sharp teases of wild fennel and nutmeg.",Gap's Crown Vineyard,58,95, $0.61 ,California,Sonoma,"38.2918590, -122.4580356",38.291859,-122.4580356,Sonoma Coast,"38.5779555, -122.9888319",38.5779555,-122.9888319,Black Kite 2015 Gap's Crown Vineyard Chardonnay (Sonoma Coast),https://www.winemag.com/buying-guide/black-kite-2015-gaps-crown-vineyard-chardonnay-sonoma-coast-278959/,Chardonnay,2015,Black Kite
winemag 801 to 1600,11859,213902,13.8,White,US,A scent of French butter offers an immediate invitation to this excellent wine. Austerity on the palate gives way to a juicy core of invigorating tangerine and white peach flavors. The gravelly minerality on the midpalate finishes softly and with ease.,Russian River Selection,35,95, $0.37 ,California,Sonoma,"38.2918590, -122.4580356",38.291859,-122.4580356,Russian River Valley,"38.9119799, -123.0537083",38.9119799,-123.0537083,Gary Farrell 2015 Russian River Selection Chardonnay (Russian River Valley),https://www.winemag.com/buying-guide/gary-farrell-2015-russian-river-selection-chardonnay-russian-river-valley/,Chardonnay,2015,Gary Farrell
winemag 801 to 1600,12081,214124,13.5,White,US,"Originating from a small, new producer based in the Napa Valley, this shows crushed stone and golden oak. Its essential succulence is that of high-toned citrus and apple kissed in caramel. A tease of lingering acidity makes it undeniably fresh and deliciously crisp.",Laurent Ritchie Vineyard,65,95, $0.68 ,California,Sonoma,"38.2918590, -122.4580356",38.291859,-122.4580356,Russian River Valley,"38.9119799, -123.0537083",38.9119799,-123.0537083,Metzker Family Estates 2015 Laurent Ritchie Vineyard Chardonnay (Russian River Valley),https://www.winemag.com/buying-guide/metzker-family-estates-2015-laurent-ritchie-vineyard-chardonnay-russian-river-valley/,Chardonnay,2015,Metzker Family Estates
winemag 801 to 1600,12095,214138,14.7,White,US,"This wine is undeniably floral and voluptuous and hard to resist on the nose alone. Honeysuckle, lemon peel and flint tease and please around a focused core of oak and gritty texture of stone. Full bodied, it's lush and slightly reduced-a compelling statement on power and grace.",Pratt Vineyard Vine Hill Road,45,95, $0.47 ,California,Sonoma,"38.2918590, -122.4580356",38.291859,-122.4580356,Russian River Valley,"38.9119799, -123.0537083",38.9119799,-123.0537083,MacPhail 2015 Pratt Vineyard Vine Hill Road Chardonnay (Russian River Valley),https://www.winemag.com/buying-guide/macphail-2015-pratt-vineyard-vine-hill-road-chardonnay-russian-river-valley/,Chardonnay,2015,MacPhail
winemag 801 to 1600,12101,214144,14.2,White,US,"With a persistence of lightly-toasted oak, this youthful wine offers intense luxury. A gritty, stony texture complements its delicious aspects of lemon rind and anise. Green apple, ocean spray and an underlying streak of dried herb provide additional complexity and length.",Three Sisters,48,95, $0.51 ,California,Sonoma,"38.2918590, -122.4580356",38.291859,-122.4580356,Fort Ross-Seaview,"38.5140796, -123.2436186",38.5140796,-123.2436186,Benovia 2015 Three Sisters Chardonnay (Fort Ross-Seaview),https://www.winemag.com/buying-guide/benovia-2015-three-sisters-chardonnay-fort-ross-seaview/,Chardonnay,2015,Benovia
winemag 801 to 1600,12103,214146,14.1,White,US,"Plump aromas of lemon mousse, meringue, wet limestone, white flowers and ripe key lime show on the nose of this excellent bottling. The palate bursts with flavors of cool cream, sea salt and lemon pith, set against a chalky texture. A mysteriously compelling experience.",Oliver's Vineyard,38,95, $0.40 ,California,Central Coast,"35.6368759, -120.6545022",35.6368759,-120.6545022,Edna Valley,"35.2001752, -120.6069776",35.2001752,-120.6069776,Talley 2015 Oliver's Vineyard Chardonnay (Edna Valley),https://www.winemag.com/buying-guide/talley-2015-olivers-vineyard-chardonnay-edna-valley/,Chardonnay,2015,Talley
winemag 801 to 1600,13660,215703,13,White,US,"Clean lines of nectarine, lemon blossom, orange sorbet and wet rock show on the lovely nose of this bottling from Trey Fletcher. Boisterous energy and a chalky grip power the palate, where citrus freshness dominates, and the acidity is powerful but not overblown. It will age with beauty and grace. Drink 2018-2035.",,45,95, $0.47 ,California,Central Coast,"35.6368759, -120.6545022",35.6368759,-120.6545022,Santa Maria Valley,"34.9530337, -120.4357191",34.9530337,-120.4357191,Solomon Hills 2015 Chardonnay (Santa Maria Valley),https://www.winemag.com/buying-guide/solomon-hills-2015-chardonnay-santa-maria-valley/,Chardonnay,2015,Solomon Hills
winemag 801 to 1600,13674,215717,14.4,White,US,"An inviting hint of butter shows on the nose of this big, bold and concentrated wine. It displays craftsmanship through its embrace of lightly toasted oak, which accents vibrant apple and pear notes. It's lushly textured, with persistent acidity and a lemon peel flourish on the close.",Quail Hill Vineyard,60,95, $0.63 ,California,Sonoma,"38.2918590, -122.4580356",38.291859,-122.4580356,Russian River Valley,"38.9119799, -123.0537083",38.9119799,-123.0537083,Lynmar 2015 Quail Hill Vineyard Chardonnay (Russian River Valley),https://www.winemag.com/buying-guide/lynmar-2015-quail-hill-vineyard-chardonnay-russian-river-valley/,Chardonnay,2015,Lynmar
winemag 801 to 1600,13675,215718,14.4,White,US,"Brine and oak accents cradle this impressive wine's elegant green apple, wet stone and lime notes. Bold and concentrated yet complex, it's balanced by lively acidity and persistent freshness.",Monastery,55,95, $0.58 ,California,Sonoma,"38.2918590, -122.4580356",38.291859,-122.4580356,Russian River Valley,"38.9119799, -123.0537083",38.9119799,-123.0537083,Lynmar 2015 Monastery Chardonnay (Russian River Valley),https://www.winemag.com/buying-guide/lynmar-2015-monastery-chardonnay-russian-river-valley/,Chardonnay,2015,Lynmar
winemag 801 to 1600,13677,215720,14.5,White,US,"This rich and voluptuous wine wins one over with its baked pear and vanilla sumptuousness, etched with an apple blossom aroma. Robust and velvety on the palate, it's balanced by fresh citrus and wet stone nuances. The lifted acidity provokes both succulence and complexity.",Brumaire,40,95, $0.42 ,California,Sonoma,"38.2918590, -122.4580356",38.291859,-122.4580356,Russian River Valley,"38.9119799, -123.0537083",38.9119799,-123.0537083,EnRoute 2015 Brumaire Chardonnay (Russian River Valley),https://www.winemag.com/buying-guide/enroute-2015-brumaire-chardonnay-russian-river-valley/,Chardonnay,2015,EnRoute
winemag 801 to 1600,13682,215725,14.6,White,US,"This is a velvety smooth, superbly made white with delightful sparks of fresh-squeezed lemon, stone and salt. Ginger and lemongrass touches add an exotic quality, enhancing its bright freshness and core of acid-led tension.",La Sereinite,70,95, $0.74 ,California,Sonoma,"38.2918590, -122.4580356",38.291859,-122.4580356,Russian River Valley,"38.9119799, -123.0537083",38.9119799,-123.0537083,Lynmar 2015 La Sereinite Chardonnay (Russian River Valley),https://www.winemag.com/buying-guide/lynmar-2015-la-sereinite-chardonnay-russian-river-valley/,Chardonnay,2015,Lynmar
winemag 801 to 1600,13971,216014,14.4,White,US,"With its high-toned sparkle of lemon zest and orange, this lovely wine evolves to show rich oak and apple pie notes, evoking baked Gravenstein apple, cinnamon and nutmeg. Medium-bodied, it wears its concentration of flavor and texture well, finding a well-earned balance through the lengthy finish.",Old Wente,55,95, $0.58 ,California,Sonoma,"38.2918590, -122.4580356",38.291859,-122.4580356,Russian River Valley,"38.9119799, -123.0537083",38.9119799,-123.0537083,Lynmar 2015 Old Wente Chardonnay (Russian River Valley),https://www.winemag.com/buying-guide/lynmar-2015-old-wente-chardonnay-russian-river-valley/,Chardonnay,2015,Lynmar
winemag 8801 to 9600,6077,223058,14.1,White,US,"A spectacular Chardonnay grown in Failla's estate vineyard, high in the mountains above the Sonoma Coast, and open to the Pacific's cool winds. The pineapple custard, tangerine, lemon tart and mineral flavors are compellingly delicious, while crisp coastal acidity adds a refreshingly clean tang. This is a grand cru wine.",,42,95, $0.44 ,California,Sonoma,"38.2918590, -122.4580356",38.291859,-122.4580356,Sonoma Coast,"38.5779555, -122.9888319",38.5779555,-122.9888319,Failla 2007 Chardonnay (Sonoma Coast),https://www.winemag.com/buying-guide/failla-2007-chardonnay-sonoma-coast/,Chardonnay,2007,Failla
winemag 8801 to 9600,6079,223060,14.7,White,US,"A big, bold, exuberantly rich wine, classic Williams Selyem Chard. The underlying wine is all pineapples, peaches, pears and exotic tropical fruits, while oak adds elaborate layers of buttered toast, caramel, nougat and vanilla. Acidity is high, which will help the wine age through 2013.",Heintz Vineyard,50,95, $0.53 ,California,Sonoma,"38.2918590, -122.4580356",38.291859,-122.4580356,Russian River Valley,"38.9119799, -123.0537083",38.9119799,-123.0537083,Williams Selyem 2007 Heintz Vineyard Chardonnay (Russian River Valley),https://www.winemag.com/buying-guide/williams-selyem-2007-heintz-vineyard-chardonnay-sonoma-russian-river-valley/,Chardonnay,2007,Williams Selyem
winemag 8801 to 9600,6080,223061,14.5,White,US,"Super-rich, a fat, opulent Chard that tastes almost as sweet as a dessert, except it's dry. Shows massive flavors of Meyer lemon custard, minerals, pear tart, buttered toast, butterscotch, smoky pie crust and honey, with a sprinkle of cinnamon and nutmeg. Lush and gorgeous.",Allen Vineyard,50,95, $0.53 ,California,Sonoma,"38.2918590, -122.4580356",38.291859,-122.4580356,Russian River Valley,"38.9119799, -123.0537083",38.9119799,-123.0537083,Williams Selyem 2007 Allen Vineyard Chardonnay (Russian River Valley),https://www.winemag.com/buying-guide/williams-selyem-2007-allen-vineyard-chardonnay-sonoma-russian-river-valley/,Chardonnay,2007,Williams Selyem
winemag 8801 to 9600,10244,227225,14.2,White,US,"How they manage to make dessert pastry flavors taste dry is a mystery. Whatever the answer is, this utterly delicious wine erupts with pineapple tart, date nut cookie, vanilla-covered orange and spicy mocha latté flavors, yet has no trace of residual sugar. Brilliant acidity makes it all clean and alive.",Brosseau Vineyard,39,95, $0.41 ,California,Central Coast,"35.6368759, -120.6545022",35.6368759,-120.6545022,Chalone,"36.4701378, -121.2298315",36.4701378,-121.2298315,Testarossa 2007 Brosseau Vineyard Chardonnay (Chalone),https://www.winemag.com/buying-guide/testarossa-2007-brosseau-vineyard-chardonnay-central-coast-chalone/,Chardonnay,2007,Testarossa
winemag 8801 to 9600,10247,227228,14.1,White,US,"Outstanding. Easily the best Signorello Chardonnay in many years, and a dramatic sign of the quality of the 2007 vintage. Shows intense tropical fruit, mineral and new oak aromas and flavors, with a rich array of dusty Asian spices. Just 72 cases were produced, but it's worth the search.",Hope's Cuvee,60,95, $0.63 ,California,Napa,"38.5024689, -122.2653887",38.5024689,-122.2653887,Napa Valley,"38.5024689, -122.2653887",38.5024689,-122.2653887,Signorello 2007 Hope's Cuvee Chardonnay (Napa Valley),https://www.winemag.com/buying-guide/signorello-2007-hopes-cuvee-chardonnay-napa-valley/,Chardonnay,2007,Signorello
winemag 8801 to 9600,10248,227229,14.5,White,US,"Testarossa's 2007 Chardonnays are out, and this La Cruz is right up there with the best of them. Rich in citrusy acids, it dazzles the palate with Mandarin orange, pineapple-infused crème brûlée, mineral, buttered toast and cinnamon spice flavors. Drink this decadent wine soon.",La Cruz Vineyard,39,95, $0.41 ,California,Sonoma,"38.2918590, -122.4580356",38.291859,-122.4580356,Sonoma Coast,"38.5779555, -122.9888319",38.5779555,-122.9888319,Testarossa 2007 La Cruz Vineyard Chardonnay (Sonoma Coast),https://www.winemag.com/buying-guide/testarossa-2007-cruz-vineyard-chardonnay-sonoma-coast/,Chardonnay,2007,Testarossa
winemag 8801 to 9600,12229,229210,14.8,White,US,"This new release, from the winery's estate vineyard, joins the ranks of older Williams Selyem single-vineyard Chardonnays, such as Allen and Hawk Hill, as some of California's most massive, powerful, dry white wines. It shows aromas and flavors of orange cream pie, white peach-infused crème brûlée, honey, butterscotch and toast, firmed up with crisp acidity. Almost a food group in itself, this beauty calls for lobster with melted butter.",Drake Estate Vineyard,60,95, $0.63 ,California,Sonoma,"38.2918590, -122.4580356",38.291859,-122.4580356,Russian River Valley,"38.9119799, -123.0537083",38.9119799,-123.0537083,Williams Selyem 2006 Drake Estate Vineyard Chardonnay (Russian River Valley),https://www.winemag.com/buying-guide/williams-selyem-2006-drake-estate-vineyard-chardonnay-sonoma-russian-river-valley/,Chardonnay,2006,Williams Selyem
winemag 8801 to 9600,12233,229214,13.5,White,US,"Joseph Phelps, of Napa Valley fame, has been working this cool-climate vineyard for years. Now it's paying off, in this acidic Chardonnay with a tang of the sea. Rich in Meyer lemon, lime, guava and spice flavors, its coating of smoky oak adds exotic levels of buttered toast and crème brûlée. Fascinating and tremendous.",,75,95, $0.79 ,California,Sonoma,"38.2918590, -122.4580356",38.291859,-122.4580356,Sonoma Coast,"38.5779555, -122.9888319",38.5779555,-122.9888319,Freestone 2006 Chardonnay (Sonoma Coast),https://www.winemag.com/buying-guide/freestone-2006-chardonnay-sonoma-coast/,Chardonnay,2006,Freestone
winemag 8801 to 9600,12234,229215,14.5,White,US,"Talley's Rosemary's typically is one of the greatest, most dependable Chardonnays in California. The 2006 upholds that distinguished tradition. It's dry and balanced, with a mineral undertone that grounds the flamboyant pineapple custard, lemondrop and lime pie flavors. Feels ultra-distinguished and elegant despite the richness. Now through 2010.",Rosemary's Vineyard,50,95, $0.53 ,California,Central Coast,"35.6368759, -120.6545022",35.6368759,-120.6545022,Arroyo Grande Valley,"35.1443363, -120.5436230",35.1443363,-120.543623,Talley 2006 Rosemary's Vineyard Chardonnay (Arroyo Grande Valley),https://www.winemag.com/buying-guide/talley-2006-rosemarys-vineyard-chardonnay-central-coast-arroyo-grande-valley/,Chardonnay,2006,Talley
