filename,record number 1,record number 2,alcohol,category,country,description,designation,price,rating,cost per point,region / state,subregion,subregion lat lon,subregion lat,subregion lon,subsubregion,subsubregion lat lon,subsubregion lat,subsubregion lon,title,url,varietal,vintage,winery
winemag 8801 to 9600,12235,229216,14.8,White,US,"Massive, as are all of Talbott's 2005 Chardonnays. The Cuvée Carlotta brings together powerful, smoky new oak with extraordinarily ripe fruit to make for a wine of fantastic opulence and decadence. The flavors are endless, a cascade of pineapple jam, apricot crème brûlée, butterscotch, cinnamon toast, vanilla cream and cotton candy flavors. As sweet as that sounds, the finish is thoroughly dry and very long.",Cuveé Carlotta Sleepy Hollow Vineyard,63,95, $0.66 ,California,Central Coast,"35.6368759, -120.6545022",35.6368759,-120.6545022,Monterey County,"36.6002378, -121.8946761",36.6002378,-121.8946761,Talbott 2005 Cuveé Carlotta Sleepy Hollow Vineyard Chardonnay (Monterey County),https://www.winemag.com/buying-guide/talbott-2005-cuvee-carlotta-sleepy-hollow-vineyard-chardonnay-central-coast-monterey-county/,Chardonnay,2005,Talbott
winemag 8801 to 9600,14718,231699,14.1,White,US,"There's a lot going on in this complex Chardonnay. The balance strikes you first, with crisp, zesty acidity cleansing the palate and preparing it for the onslaught of flavor. Then a tsunami of grilled pineapples, Meyer lemon pie filling, crème brûlée, butterscotch and vanilla hits. So devastatingly good, you can't keep your hands off it.",Estate,42,95, $0.44 ,California,Sonoma,"38.2918590, -122.4580356",38.291859,-122.4580356,Sonoma Coast,"38.5779555, -122.9888319",38.5779555,-122.9888319,Failla 2006 Estate Chardonnay (Sonoma Coast),https://www.winemag.com/buying-guide/failla-2006-estate-chardonnay-sonoma-coast/,Chardonnay,2006,Failla
winemag 9601 to 10400,3835,236491,14.5,White,US,"Hat Trick is the best of the best of Morgan's estate vineyard, which is in the chilliest northwestern part of the Highlands. Acidity stars, giving the wine a brilliant crispness that's so clean and fine. Barrel fermented in one-third new French oak, the wine is incredibly rich and leesy. The terroir has coaxed out complex layers of pineapples, Meyer lemons, limes, apricots and very exotic tropical fruits suggesting golden mangoes and papayas. The oak adds even richer layers of crème brûlée to this vastly enjoyable wine.",Double L Vineyard Hat Trick,65,95, $0.68 ,California,Central Coast,"35.6368759, -120.6545022",35.6368759,-120.6545022,Santa Lucia Highlands,"36.4307709, -121.4203754",36.4307709,-121.4203754,Morgan 2006 Double L Vineyard Hat Trick Chardonnay (Santa Lucia Highlands),https://www.winemag.com/buying-guide/morgan-2006-double-l-vineyard-hat-trick-chardonnay-central-coast-santa-lucia-highlands/,Chardonnay,2006,Morgan
winemag 9601 to 10400,5673,238329,14.8,White,US,"Rich and satisfying, this opulent Chardonnay dazzles with sheer deliciousness. Master winemaker Richard Arrowood has pulled out all the stops on this Burgundian-style wine. The flavors, of pineapple custard, lemon meringue, green apple butter, crème brûlée and gingersnap cookie, are balanced by perfect acidity. This is by far Arrowood's greatest Chardonnay in recent memory.",Reserve Speciale,35,95, $0.37 ,California,Sonoma,"38.2918590, -122.4580356",38.291859,-122.4580356,Sonoma County,"38.7596420, -123.0915605",38.759642,-123.0915605,Arrowood 2005 Reserve Speciale Chardonnay (Sonoma County),https://www.winemag.com/buying-guide/arrowood-2005-reserve-speciale-chardonnay-sonoma-county/,Chardonnay,2005,Arrowood
winemag 9601 to 10400,10160,242816,13.7,White,US,"A very fine Chard, complex and layered, and quite dry. Acidity makes the tangerine, kumquat, ripe yellow pear, roasted pineapple and oaky, crème brûlée flavors really come alive. After you swallow, the wine leaves behind a delicious impression.",Dutton Ranch Rued Vineyard,45,95, $0.47 ,California,Sonoma,"38.2918590, -122.4580356",38.291859,-122.4580356,Russian River Valley,"38.9119799, -123.0537083",38.9119799,-123.0537083,Dutton-Goldfield 2005 Dutton Ranch Rued Vineyard Chardonnay (Russian River Valley),https://www.winemag.com/buying-guide/dutton-goldfield-2005-ranch-rued-vineyard-chardonnay-sonoma-russian-river-valley/,Chardonnay,2005,Dutton-Goldfield
winemag 9601 to 10400,10902,243558,14.4,White,US,"Chateau St. Jean continues to teach Chard wannabes how the game is played. This is a huge wine, but one of extraordinary finesse and interest. One reason is winemaker Margo van Staaveren's instinct for controlled tension. Another is the winery's access to fruit from throughout the county. Rich and opulent and powerful, this Chardonnay is, in a word, great.",Reserve,45,95, $0.47 ,California,Sonoma,"38.2918590, -122.4580356",38.291859,-122.4580356,Sonoma County,"38.7596420, -123.0915605",38.759642,-123.0915605,Chateau St. Jean 2004 Reserve Chardonnay (Sonoma County),https://www.winemag.com/buying-guide/chateau-st-jean-2004-reserve-chardonnay-sonoma-county/,Chardonnay,2004,Chateau St. Jean
winemag 9601 to 10400,12504,245160,14.7,White,US,"Absolutely delicious, first-rate Chard from this veteran producer. Shows the prettiest balance of all its parts, and just about as good as California Chard gets. Ripely opulent in tropical fruit, apricot and tangerine flavors and crisp in limey acids, the wine's 50% new oak adds luscious notes of buttercream, toast, smoke and vanilla.",Damiana Vineyard,45,95, $0.47 ,California,Central Coast,"35.6368759, -120.6545022",35.6368759,-120.6545022,Santa Cruz Mountains,"36.9741171, -122.0307963",36.9741171,-122.0307963,Thomas Fogarty 2004 Damiana Vineyard Chardonnay (Santa Cruz Mountains),https://www.winemag.com/buying-guide/thomas-fogarty-2004-damiana-vineyard-chardonnay-central-coast-santa-cruz-mountains/,Chardonnay,2004,Thomas Fogarty
winemag 9601 to 10400,12505,245161,,White,US,"The mountain vineyard somehow manages not only to beautifully ripen the grapes to a great expression of fruit, but also preserves vital acidity and lends a firm layer of minerality. The result is a big, powerful wine that easily absorbs its lavish coat of new oak. The flavors are of candied pineapple tart, Meyer lemon mousse and vanilla custard, with a finish of sweet, crushed Asian spices. Perfect now, and just beginning to gather momentum. Drink through 2011, at least, with proper cellaring.",Estate Bottled,38,95, $0.40 ,California,Central Coast,"35.6368759, -120.6545022",35.6368759,-120.6545022,Santa Cruz Mountains,"36.9741171, -122.0307963",36.9741171,-122.0307963,Mount Eden Vineyards 2003 Estate Bottled Chardonnay (Santa Cruz Mountains),https://www.winemag.com/buying-guide/mount-eden-2003-estate-bottled-chardonnay-central-coast-santa-cruz-mountains/,Chardonnay,2003,Mount Eden Vineyards
winemag 1 to 800,4092,4092,13.8,White,US,"A white peach aroma meets hazelnut, lemon cream, brioche, whipped butter and salt on the lavish and yet restrained nose of this bottling. An iron grip immediately seizes the palate with chalky tension and flavors, then smooths into tones of lemon preserves on toast, tangerine zest, vanilla dust and sea salt caramel.",Rosemary's Vineyard Estate Bottled,48,96, $0.50 ,California,Central Coast,"35.6368759, -120.6545022",35.6368759,-120.6545022,Arroyo Grande Valley,"35.1443363, -120.5436230",35.1443363,-120.543623,Talley 2016 Rosemary's Vineyard Estate Bottled Chardonnay (Arroyo Grande Valley),https://www.winemag.com/buying-guide/talley-2016-rosemarys-vineyard-estate-bottled-chardonnay-arroyo-grande-valley/,Chardonnay,2016,Talley
winemag 1 to 800,6087,6087,14.2,White,US,"From a new vineyard site named for the producers' son, this is immensely rich, rounded and spicy in nutmeg, clove and ginger, completely inviting and immersive on the nose and palate. Made in a balanced, brightly complex style, it offers plenty of depth and nuance between the scenes, in full exploration of crisp to baked apple and pear.",Adam's Vineyard,60,96, $0.63 ,California,Sonoma,"38.2918590, -122.4580356",38.291859,-122.4580356,Russian River Valley,"38.9119799, -123.0537083",38.9119799,-123.0537083,Lynmar 2016 Adam's Vineyard Chardonnay (Russian River Valley),https://www.winemag.com/buying-guide/lynmar-2016-adams-vineyard-chardonnay-russian-river-valley/,Chardonnay,2016,Lynmar
winemag 10401 to 11200,45,15307,15.1,White,US,"Massive, complex, with amazing depth, an opulent, voluptuous wine of tremendous power and authority. It's so beautiful now, you almost hesitate to cellar it, but these Hanzell Chards are built for the long haul. Positively volcanic in tropical fruit and toasty new oak, with a honeyed, caramel finish. Absolutely stunning.",,65,96, $0.68 ,California,Sonoma,"38.2918590, -122.4580356",38.291859,-122.4580356,Sonoma Valley,"38.2918590, -122.4580356",38.291859,-122.4580356,Hanzell 2004 Chardonnay (Sonoma Valley),https://www.winemag.com/buying-guide/hanzell-2004-chardonnay-sonoma-valley/,Chardonnay,2004,Hanzell
winemag 10401 to 11200,1728,16990,14.8,White,US,"This is one of the best Chardonnays I've had recently. It's a tremendously ripe wine, exploding with apricot nectar, peach custard, quince, butterscotch, buttered toast and spice flavors. There's even a spine of minerality. But what really makes it so special is the acidity. This is just a tremendous Chard, totally addictive, and it's best now in its flamboyant youth.",Allen Vineyard,48,96, $0.50 ,California,Sonoma,"38.2918590, -122.4580356",38.291859,-122.4580356,Russian River Valley,"38.9119799, -123.0537083",38.9119799,-123.0537083,Williams Selyem 2004 Allen Vineyard Chardonnay (Russian River Valley),https://www.winemag.com/buying-guide/williams-selyem-2004-allen-vineyard-chardonnay-sonoma-russian-river-valley/,Chardonnay,2004,Williams Selyem
winemag 10401 to 11200,3323,18585,14.3,White,US,"This has typical Talbottian heft, a gigantic Chard enormously rich in oak and munificent in flavor. Light pressing has captured the quintessence of cool-climate Chardonnay, heavenly rich and powerful, a flood of pineapple tart, Key lime pie, crème brûlée, smoky meringue and vanilla cinnamon toast.",Diamond T Estate,65,96, $0.68 ,California,Central Coast,"35.6368759, -120.6545022",35.6368759,-120.6545022,Monterey,"36.3136201, -121.3541631",36.3136201,-121.3541631,Talbott 2002 Diamond T Estate Chardonnay (Monterey),https://www.winemag.com/buying-guide/talbott-2002-diamond-t-estate-chardonnay-central-coast-monterey/,Chardonnay,2002,Talbott
winemag 10401 to 11200,4220,19482,14.4,White,US,"What a roll St. Jean has been on with Chardonnay. This wine was made from a majority of Robert Young and Belle Terre vineyard fruit, and is two-thirds new French oak. The combination is mind-blowing. The vineyards contribute concentrated spicy, tropical fruit flavors and perfect acid balance, while the oak provides elaborate seasoning. Absolutely delicious. One of the most satisfying Chards of the vintage.",Reserve,45,96, $0.47 ,California,Sonoma,"38.2918590, -122.4580356",38.291859,-122.4580356,Sonoma County,"38.7596420, -123.0915605",38.759642,-123.0915605,Chateau St. Jean 2003 Reserve Chardonnay (Sonoma County),https://www.winemag.com/buying-guide/chateau-st-jean-2003-reserve-chardonnay-sonoma-county/,Chardonnay,2003,Chateau St. Jean
winemag 10401 to 11200,8696,23958,14.3,White,US,"This tiny-production, best-of-barrels bottling is  ncredibly rich, and not unlike grand cru Burgundy. There are similarities in the Baroque structure and complex, layered lemondrop flavors that new oak so flatters. There's a tight, minerally acidity; it's a little leesy-sour right now, and all the parts haven't come together, but for sheer dazzle, you can't beat it. Cellar until the end of 2006 and drink through 2008.",Diamond T Estate Cuvée Audrey,75,96, $0.78 ,California,Central Coast,"35.6368759, -120.6545022",35.6368759,-120.6545022,Monterey,"36.3136201, -121.3541631",36.3136201,-121.3541631,Talbott 2002 Diamond T Estate Cuvée Audrey Chardonnay (Monterey),https://www.winemag.com/buying-guide/talbott-2002-diamond-t-estate-cuvee-audrey-chardonnay-central-coast-monterey/,Chardonnay,2002,Talbott
winemag 10401 to 11200,8697,23959,14.5,White,US,"The fruit is massive, succulent in pineapple custard, Key lime pie and roasted coconut, and the oak is also powerful in new, charred character. There there's the brilliant acidity that makes it all work.",Rosemary's Vineyard,44,96, $0.46 ,California,Central Coast,"35.6368759, -120.6545022",35.6368759,-120.6545022,Arroyo Grande Valley,"35.1443363, -120.5436230",35.1443363,-120.543623,Talley 2003 Rosemary's Vineyard Chardonnay (Arroyo Grande Valley),https://www.winemag.com/buying-guide/talley-2003-rosemarys-vineyard-chardonnay-central-coast-arroyo-grande-valley/,Chardonnay,2003,Talley
winemag 11201 to 12000,3016,33965,14.2,White,US,"This low production barrel selection from Morgan's Double L Vineyard is one of the best Chards of the vintage. Has everything Double L has, but more. Fabulous weight and density, and tiers of flavors ranging from pineapples through peaches, creme brulee and butterscotch. Fat, almost meaty, yet dry, elegant and refined.",Hat Trick Double L Vineyard,50,96, $0.52 ,California,Central Coast,"35.6368759, -120.6545022",35.6368759,-120.6545022,Santa Lucia Highlands,"36.4307709, -121.4203754",36.4307709,-121.4203754,Morgan 2002 Hat Trick Double L Vineyard Chardonnay (Santa Lucia Highlands),https://www.winemag.com/buying-guide/morgan-2002-hat-trick-double-l-vineyard-chardonnay-central-coast-santa-lucia-highlands/,Chardonnay,2002,Morgan
winemag 12001 to 12800,8634,55325,,White,US,"This long-anticipated wine from a longtime grower-turned-vintner swings for the fences. Begins with fascinating, complex aromas-highlighted by lees, pineapple, cinnamon, smoke and white chocolate-and dazzles with its sheer opulence. Everything comes together in pinpointed harmony, right down to the mind-bogglingly beautiful finish.",,35,96, $0.36 ,California,Sonoma,"38.2918590, -122.4580356",38.291859,-122.4580356,Alexander Valley,"38.6129647, -122.7694345",38.6129647,-122.7694345,Robert Young 1999 Chardonnay (Alexander Valley),https://www.winemag.com/buying-guide/robert-young-1999-chardonnay-sonoma-alexander-valley/,Chardonnay,1999,Robert Young
winemag 12001 to 12800,13852,60543,,White,US,"A fabulous first Chardonnay under his own name by winemaker David Ramey (previously of Chalk Hill, Matanzas Creek, Dominus and elsewhere). Smoky and intriguing fruit. Rich mouthfeel, beautiful texture and balance. Very flavorful, but more than that, it shows tremendous nuance and subtlety. Sensuous and profound.",,65,96, $0.68 ,California,Carneros,"38.2630002, -122.3415289",38.2630002,-122.3415289,Carneros,"38.2630002, -122.3415289",38.2630002,-122.3415289,Ramey 1996 Chardonnay (Carneros),https://www.winemag.com/buying-guide/ramey-1996-chardonnay-napa-sonoma-carneros/,Chardonnay,1996,Ramey
winemag 1601 to 2400,6169,68119,13.6,White,US,"This Chardonnay-one of the best tasted in months-is light in the glass and shows clean, refreshing, yet compellingly rich sea salt, toasted sourdough, key lime and daffodil aromas. Its unique palate blends bright lemon-lime, Asian pear and Marcona almond flavors with a crushed shell minerality that brings the seashore to mind.",White Hills Vineyard,65,96, $0.68 ,California,Central Coast,"35.6368759, -120.6545022",35.6368759,-120.6545022,Santa Barbara County,"34.4208305, -119.6981901",34.4208305,-119.6981901,D'Alfonso-Curran 2013 White Hills Vineyard Chardonnay (Santa Barbara County),https://www.winemag.com/buying-guide/dalfonso-curran-2013-white-hills-vineyard-chardonnay-santa-barbara-county/,Chardonnay,2013,D'Alfonso-Curran
winemag 1601 to 2400,10119,72069,14.3,White,US,"Dark gold in color, this is a memorably luxurious and vivacious wine, tangy in grapefruit, burnt orange and cardamom. Layered and complex, it evolves as it opens to a lingering tease of butterscotch topped in nutmeg. It is an outstanding vision of an outstanding site, a wine for the ages.",Ritchie Vineyard,60,96, $0.63 ,California,Sonoma,"38.2918590, -122.4580356",38.291859,-122.4580356,Russian River Valley,"38.9119799, -123.0537083",38.9119799,-123.0537083,Gary Farrell 2014 Ritchie Vineyard Chardonnay (Russian River Valley),https://www.winemag.com/buying-guide/gary-farrell-2014-ritchie-vineyard-chardonnay-russian-river-valley/,Chardonnay,2014,Gary Farrell
winemag 1601 to 2400,11491,73441,14.6,White,US,"This high-toned, lovely wine is a best-of blend from several vineyards-primarily Ritchie and Banfield. Sugar pie apple and fig flavors form a robustly concentrated fruitiness that's ribbed with vibrant minerality. A clarified butter-like creaminess comes through on the finish.",,54,96, $0.56 ,California,Sonoma,"38.2918590, -122.4580356",38.291859,-122.4580356,Russian River Valley,"38.9119799, -123.0537083",38.9119799,-123.0537083,Arista 2014 Chardonnay (Russian River Valley),https://www.winemag.com/buying-guide/arista-2014-chardonnay-russian-river-valley/,Chardonnay,2014,Arista
winemag 2401 to 3200,9437,86857,14.5,White,US,"A waft of smoky char and toasty oak provide a rich foundation and compelling entry into this one-acre vineyard-designate from the historic grower, before unleashing, slowly, a torrent of melon and fresh-cut apple with a length of intriguing nutmeg and cardamom. Medium-bodied and lush, it will remain on your palate memory a long time.",Sweetwater,68,96, $0.71 ,California,Sonoma,"38.2918590, -122.4580356",38.291859,-122.4580356,Russian River Valley,"38.9119799, -123.0537083",38.9119799,-123.0537083,Rochioli 2014 Sweetwater Chardonnay (Russian River Valley),https://www.winemag.com/buying-guide/rochioli-2014-sweetwater-chardonnay-russian-river-valley/,Chardonnay,2014,Rochioli
winemag 2401 to 3200,9439,86859,14.5,White,US,"Citrus-kissed saltiness lies at the core of this incredibly delicious, deliriously crafted wine, from the great grape grower in the heart of the Russian River Valley. Beautifully crisp, it lingers in stony minerality and a freshness of apricot, memorable from first sip to last.",South River,68,96, $0.71 ,California,Sonoma,"38.2918590, -122.4580356",38.291859,-122.4580356,Russian River Valley,"38.9119799, -123.0537083",38.9119799,-123.0537083,Rochioli 2014 South River Chardonnay (Russian River Valley),https://www.winemag.com/buying-guide/rochioli-2014-south-river-chardonnay-russian-river-valley/,Chardonnay,2014,Rochioli
winemag 2401 to 3200,10992,88412,13.9,White,US,"The Heintz Vineyard is on the outskirts of the AVA, really pushing toward the coast, with the expected cool-climate characteristics of fresh acidity and complex, savory tones. This wine wows in every way, from its notes of exotic coconut meat and apple pie to its tang of Meyer lemon, all accented by bergamot and anise. The spice rides a wave of body and length toward the finish, alongside an unmistakable streak of minerality. Hold through 2024.",Heintz Vineyard,58,96, $0.60 ,California,Sonoma,"38.2918590, -122.4580356",38.291859,-122.4580356,Russian River Valley,"38.9119799, -123.0537083",38.9119799,-123.0537083,Williams Selyem 2014 Heintz Vineyard Chardonnay (Russian River Valley),https://www.winemag.com/buying-guide/williams-selyem-2014-heintz-vineyard-chardonnay-russian-river-valley/,Chardonnay,2014,Williams Selyem
winemag 3201 to 4000,11368,104248,13.8,White,US,"To tame Durell is no easy feat-indeed at first this wine exudes matchstick and robustness on the nose and palate. But tameness comes in the form of lemon and grapefruit pith, brightening the load, with a sinewy structure supporting its core. The finish is succulent in honey and stone. Drink now through 2020.",Durell Vineyard,55,96, $0.57 ,California,Sonoma,"38.2918590, -122.4580356",38.291859,-122.4580356,Sonoma Valley,"38.2918590, -122.4580356",38.291859,-122.4580356,Gary Farrell 2013 Durell Vineyard Chardonnay (Sonoma Valley),https://www.winemag.com/buying-guide/gary-farrell-2013-durell-vineyard-chardonnay-sonoma-valley/,Chardonnay,2013,Gary Farrell
winemag 4001 to 4800,4260,112673,14.5,White,US,"This longstanding collaboration between vintner and grower reflects years of mutual understanding and respect. The wine offers pretty orange blossom and lemon verbena aromas that wrap around a composed, well-integrated and mineral-laden body. Voluptuous, the wine is also well-balanced, finishing in bright acidity. It is deliciously good.",Hyde Vineyard,65,96, $0.68 ,California,Carneros,"38.2630002, -122.3415289",38.2630002,-122.3415289,Carneros,"38.2630002, -122.3415289",38.2630002,-122.3415289,Ramey 2012 Hyde Vineyard Chardonnay (Carneros),https://www.winemag.com/buying-guide/ramey-2012-hyde-vineyard-chardonnay-napa-carneros-valley/,Chardonnay,2012,Ramey
winemag 4001 to 4800,4263,112676,14.5,White,US,"This wine comes from a new vineyard source for the producer, who continues to astound with Chardonnay. The site rises to well-crafted heights in the winemaker's hands. Made in a small quantity, the wine offers zesty lemon intensity and concentrated acidity, the entire balanced experience rewarding in its bright complexity.",Woolsey Road Vineyard,65,96, $0.68 ,California,Sonoma,"38.2918590, -122.4580356",38.291859,-122.4580356,Russian River Valley,"38.9119799, -123.0537083",38.9119799,-123.0537083,Ramey 2012 Woolsey Road Vineyard Chardonnay (Russian River Valley),https://www.winemag.com/buying-guide/ramey-2012-woolsey-road-vineyard-chardonnay-sonoma-russian-river-valley/,Chardonnay,2012,Ramey
winemag 4001 to 4800,9000,117413,14.5,White,US,"Those who think they prefer anything but Chardonnay may be convinced otherwise with this wine. It is so powerfully evocative in crisply rendered Meyer lemon and tangerine notes, with aromas of fresh white flowers teasing provocatively on the nose. Seamless and seductively bright in acidity, it glides down the palate, hinting at a richness that never becomes overdone.",Drake Estate Vineyard,65,96, $0.68 ,California,Sonoma,"38.2918590, -122.4580356",38.291859,-122.4580356,Russian River Valley,"38.9119799, -123.0537083",38.9119799,-123.0537083,Williams Selyem 2012 Drake Estate Vineyard Chardonnay (Russian River Valley),https://www.winemag.com/buying-guide/williams-selyem-2012-drake-estate-vineyard-chardonnay-sonoma-russian-river-valley/,Chardonnay,2012,Williams Selyem
winemag 5601 to 6400,13701,153172,14.6,White,US,"The acidity really makes this Chardonnay come alive, providing vitality, a quality that's boosted by an undercurrent of minerals. It's so rich in tropical fruit, orange, nectarine and pear flavors, and so generously oaked, which brings a sweet, satisfying note of buttered toast, that all you want to do is drink it now, preferably with steamed lobster and melted butter.",Heintz Vineyard,50,96, $0.52 ,California,Sonoma,"38.2918590, -122.4580356",38.291859,-122.4580356,Russian River Valley,"38.9119799, -123.0537083",38.9119799,-123.0537083,Williams Selyem 2010 Heintz Vineyard Chardonnay (Russian River Valley),https://www.winemag.com/buying-guide/williams-selyem-2010-heintz-vineyard-chardonnay-sonoma-russian-river-valley/,Chardonnay,2010,Williams Selyem
winemag 5601 to 6400,13702,153173,14.7,White,US,"Winemaker Bob Cabral's three 2010 Chardonnays are possibly the greatest he's ever made. This bottling shows fabulous complexity and sheer deliciousness, offering intricate notes of butterscotch, tropical fruit, pear tart, golden apricot, vanilla cream, buttered toast and exotic spice, with perhaps just a trace of honey. Its brilliant acidity and a tangy minerality provide the balance that pushes this wine off the charts.",Drake Estate Vineyard,65,96, $0.68 ,California,Sonoma,"38.2918590, -122.4580356",38.291859,-122.4580356,Russian River Valley,"38.9119799, -123.0537083",38.9119799,-123.0537083,Williams Selyem 2010 Drake Estate Vineyard Chardonnay (Russian River Valley),https://www.winemag.com/buying-guide/williams-selyem-2010-drake-estate-vineyard-chardonnay-sonoma-russian-river-valley/,Chardonnay,2010,Williams Selyem
winemag 6401 to 7200,2131,157268,14.7,White,US,"Astonishingly rich, this is everything you want a Chardonnay to be. It's fantastically concentrated in pineapple, guava, green apple, pear and lime fruits; it's creamy and suave in lees influence; and it's brisk in acidity, despite undergoing malolactic fermentation. The texture is honeyed, with a perfect touch of smoky, new French oak. The estate grapes come from the winery's vineyard high up in the Vaca Mountains, east of the Silverado Trail.",Finch Hollow Estate Grown Cave Fermented Unfiltered,115,96, $1.20 ,California,Napa,"38.5024689, -122.2653887",38.5024689,-122.2653887,Napa Valley,"38.5024689, -122.2653887",38.5024689,-122.2653887,Jarvis 2010 Finch Hollow Estate Grown Cave Fermented Unfiltered Chardonnay (Napa Valley),https://www.winemag.com/buying-guide/jarvis-2010-finch-hollow-estate-grown-cave-fermented-unfiltered-chardonnay-napa-valley/,Chardonnay,2010,Jarvis
winemag 6401 to 7200,3360,158497,14.7,White,US,"Rich and complex, this dry, terroir-driven wine completely avoids the sweet butter creaminess and jamminess of so many Chardonnays, showcasing instead notes of tropical fruits and pears. It's framed by minerals and even a fresh herbaceousness that suggests the wild plants growing around this Sonoma Coast vineyard. While the oak influences are strong, they are perfectly in keeping with the underlying volume.",Cinghiale Vineyard Family Reserve,125,96, $1.30 ,California,Sonoma,"38.2918590, -122.4580356",38.291859,-122.4580356,Sonoma Coast,"38.5779555, -122.9888319",38.5779555,-122.9888319,Del Dotto 2009 Cinghiale Vineyard Family Reserve Chardonnay (Sonoma Coast),https://www.winemag.com/buying-guide/dotto-2009-cinghiale-vineyard-family-reserve-chardonnay-sonoma-coast/,Chardonnay,2009,Del Dotto
