filename,record number 1,record number 2,alcohol,category,country,description,designation,price,rating,cost per point,region / state,subregion,subregion lat lon,subregion lat,subregion lon,subsubregion,subsubregion lat lon,subsubregion lat,subsubregion lon,title,url,varietal,vintage,winery
winemag 5601 to 6400,8040,147511,14.2,White,US,"This wine could easily be mistaken for French Chablis. It's notable for the tight, nervous feeling that acidity and minerals combine to stimulate, and the finish is very dry. There is, fortunately, a great heart of sweet tropical fruit, like the purest golden mango purée, ripe and succulent and honeyed. Terrific now, but such is the balance that this could be one of those Chardonnays that changes in interesting ways over the next 5-6 years.",Quail Hill Vineyard,55,95, $0.58 ,California,Sonoma,"38.2918590, -122.4580356",38.291859,-122.4580356,Russian River Valley,"38.9119799, -123.0537083",38.9119799,-123.0537083,Lynmar 2011 Quail Hill Vineyard Chardonnay (Russian River Valley),https://www.winemag.com/buying-guide/lynmar-2011-quail-hill-vineyard-chardonnay-sonoma-russian-river-valley/,Chardonnay,2011,Lynmar
winemag 5601 to 6400,14990,154461,14.2,White,US,"There isn't a Chardonnay out there as rich, opulent and delicious as this one. It dazzles with tropical fruit, pear, peach, green apple, honey, vanilla and cinnamon spice flavors. Brisk, lime-driven acidity provides beautiful balance. It's oaky, but the smoky, buttered-toast and butterscotch notes are nearly perfect. Drink now with rich crab, lobster or scallop dishes.",Edwards James Estate Wente Selection,75,95, $0.79 ,California,Sonoma,"38.2918590, -122.4580356",38.291859,-122.4580356,Russian River Valley,"38.9119799, -123.0537083",38.9119799,-123.0537083,Paul Hobbs 2010 Edwards James Estate Wente Selection Chardonnay (Russian River Valley),https://www.winemag.com/buying-guide/paul-hobbs-2010-edwards-james-estate-wente-selection-chardonnay-sonoma-russian-river-valley/,Chardonnay,2010,Paul Hobbs
winemag 5601 to 6400,14999,154470,14.2,White,US,"This is a Chardonnay for red wine lovers. It's full bodied and oaky, and it grows better as it warms in the glass. Airing brings out sweet honey, orange jam, apricot and tropical fruit favors, yet the acidity and minerality also develop, providing balance. The oak develops too, with buttered toast and butterscotch notes bringing additional richness.",Edwards James Estate Bato Selection,75,95, $0.79 ,California,Sonoma,"38.2918590, -122.4580356",38.291859,-122.4580356,Russian River Valley,"38.9119799, -123.0537083",38.9119799,-123.0537083,Paul Hobbs 2010 Edwards James Estate Bato Selection Chardonnay (Russian River Valley),https://www.winemag.com/buying-guide/paul-hobbs-2010-edwards-james-estate-bato-selection-chardonnay-sonoma-russian-river-valley/,Chardonnay,2010,Paul Hobbs
winemag 6401 to 7200,2119,157256,14.7,White,US,"Unbelievably rich and decadent, this tastes of honey drizzled over crushed ripe pineapples, guavas and pears. Added hints of buttered toast, vanilla bean, caramel and sweet cream come with scads of savory pie spices.",Finch Hollow Estate Grown Cave Fermented,95,95, $1.00 ,California,Napa,"38.5024689, -122.2653887",38.5024689,-122.2653887,Napa Valley,"38.5024689, -122.2653887",38.5024689,-122.2653887,Jarvis 2010 Finch Hollow Estate Grown Cave Fermented Chardonnay (Napa Valley),https://www.winemag.com/buying-guide/jarvis-2010-finch-hollow-estate-grown-cave-fermented-chardonnay-napa-valley/,Chardonnay,2010,Jarvis
winemag 6401 to 7200,3329,158466,14.7,White,US,"This is so dry, minerally and richly complex, you'd swear you were drinking great French Chablis. Brisk acidity and a steely stoniness give the apricot and citrus fruits a backbone of iron and iodine. Oak is there, but subtly lurking in the background, lending a hint of buttered toast. A beautiful wine, classy and upscale for drinking now.",Cinghiale Vineyard Gerard's Blend,85,95, $0.89 ,California,Sonoma,"38.2918590, -122.4580356",38.291859,-122.4580356,Sonoma Coast,"38.5779555, -122.9888319",38.5779555,-122.9888319,Del Dotto 2009 Cinghiale Vineyard Gerard's Blend Chardonnay (Sonoma Coast),https://www.winemag.com/buying-guide/dotto-2009-cinghiale-vineyard-gerards-blend-chardonnay-sonoma-coast/,Chardonnay,2009,Del Dotto
winemag 6401 to 7200,6044,161181,14.5,White,US,"One word describes this Chardonnay: fabulous. It's really everything a California Chardonnay can deliver. Ripe tropical fruit, pear, green apple and honey flavors are wrapped into buttery, smoky oak. The richness is brightened by crisp acidity and a touch of minerals, showing its pedigree with every nuance. Drink soon, to enjoy its youthful beauty.",Sweetwater Vineyard,60,95, $0.63 ,California,Sonoma,"38.2918590, -122.4580356",38.291859,-122.4580356,Russian River Valley,"38.9119799, -123.0537083",38.9119799,-123.0537083,Rochioli 2010 Sweetwater Vineyard Chardonnay (Russian River Valley),https://www.winemag.com/buying-guide/rochioli-2010-sweetwater-vineyard-chardonnay-sonoma-russian-river-valley/,Chardonnay,2010,Rochioli
winemag 6401 to 7200,8995,164132,14.3,White,US,"A bone dry wine that's rich in steely minerals and wonderful acidity. It offers the elegance and complexity of a great premier cru, with tantalizing traces of sweet Meyer lemons, limes and exotic spices. The oak is subtle, lending aromas and flavors of buttered toast, while its time spent on the lees contributes notes of sour cream. A fabulous success for this or any vintage.",Quail Hill Vineyard,40,95, $0.42 ,California,Sonoma,"38.2918590, -122.4580356",38.291859,-122.4580356,Russian River Valley,"38.9119799, -123.0537083",38.9119799,-123.0537083,Lynmar 2010 Quail Hill Vineyard Chardonnay (Russian River Valley),https://www.winemag.com/buying-guide/lynmar-2010-quail-hill-vineyard-chardonnay-sonoma-russian-river-valley/,Chardonnay,2010,Lynmar
winemag 6401 to 7200,10026,165163,14.4,White,US,"A brilliant Chardonnay, displaying both the terroir of this fine upland part of Monterey County, and the cool vintage that let the grapes hang on the vines until they were perfectly ripe. Dazzles with pineapple and mango fruit, with a perfect jacket of sweet, vanilla-scented oak. Best of all is the acidity, which is brisk, bright and clean.",Sierra Mar Vineyard,45,95, $0.47 ,California,Central Coast,"35.6368759, -120.6545022",35.6368759,-120.6545022,Santa Lucia Highlands,"36.4307709, -121.4203754",36.4307709,-121.4203754,Roar 2010 Sierra Mar Vineyard Chardonnay (Santa Lucia Highlands),https://www.winemag.com/buying-guide/roar-2010-sierra-mar-vineyard-chardonnay-central-coast-santa-lucia-highlands/,Chardonnay,2010,Roar
winemag 6401 to 7200,15000,170137,14.5,White,US,"A tremendous Chardonnay. As always, the winery's '09 is bone dry, crisply acidic and minerally. You might call it austere at this point, with its tart finish of grapefruit. But a great Hanzell Chardonnay will improve for at least a decade, possible two, and this is a great Hanzell Chardonnay. The score reflects what the wine likely will be approximately eight years down the road.",,75,95, $0.79 ,California,Sonoma,"38.2918590, -122.4580356",38.291859,-122.4580356,Sonoma Valley,"38.2918590, -122.4580356",38.291859,-122.4580356,Hanzell 2009 Chardonnay (Sonoma Valley),https://www.winemag.com/buying-guide/hanzell-2009-chardonnay-sonoma-valley/,Chardonnay,2009,Hanzell
winemag 7201 to 8000,5397,176168,14.5,White,US,"A brilliant Chardonnay. Almost nothing quite like it out there. Great, zesty acidity makes the mouth water, and oak is strongly there but perfectly vindicated by the power of the underlying flavors. They suggest ripe pineapples and tropical fruits, peaches, honeysuckle and a firm, stony minerality that has to come from the soil. For all the richness, the wine is terrifically dry.",Fort Ross Vineyard,30,95, $0.32 ,California,Sonoma,"38.2918590, -122.4580356",38.291859,-122.4580356,Sonoma Coast,"38.5779555, -122.9888319",38.5779555,-122.9888319,Fort Ross Winery 2009 Fort Ross Vineyard Chardonnay (Sonoma Coast),https://www.winemag.com/buying-guide/fort-ross-2009-vineyard-chardonnay-sonoma-coast/,Chardonnay,2009,Fort Ross Winery
winemag 7201 to 8000,5400,176171,13.5,White,US,"Seriously good, brilliant in tart acidity even after the malolactic fermentation was completed, giving it a racy grip. Rich in pineapple and lemon tart flavors, yet crisp and elegant. A real beauty that will develop bottle complexity over the next six years.",Le Bon Climat,50,95, $0.53 ,California,Central Coast,"35.6368759, -120.6545022",35.6368759,-120.6545022,Santa Maria Valley,"34.9530337, -120.4357191",34.9530337,-120.4357191,Clendenen Family 2007 Le Bon Climat Chardonnay (Santa Maria Valley),https://www.winemag.com/buying-guide/clendenen-family-2007-le-bon-climat-chardonnay-central-coast-santa-maria-valley/,Chardonnay,2007,Clendenen Family
winemag 7201 to 8000,7040,177811,14.2,White,US,"This is easily the richest, densest, most complex of Marimar's 2007 Chardonnays. Made with extended lees contact, it has a fleshy, yeasty freshness that gives the wine extra layers. The grape flavors show typical Green Valley long hangtime notes of exotic tropical fruits, apricots, pears, honey, buttered toast, crème brûlée and sweet baking spices, brightened with acidity. A luxurious, splendid Chardonnay to drink now.",Dobles Lías Don Miguel Vineyard,45,95, $0.47 ,California,Sonoma,"38.2918590, -122.4580356",38.291859,-122.4580356,Russian River Valley,"38.9119799, -123.0537083",38.9119799,-123.0537083,Marimar Estate 2007 Dobles Lías Don Miguel Vineyard Chardonnay (Russian River Valley),https://www.winemag.com/buying-guide/marimar-estate-2007-dobles-lias-don-miguel-vineyard-chardonnay-sonoma-russian-river-valley/,Chardonnay,2007,Marimar Estate
winemag 7201 to 8000,12040,182811,14.5,White,US,"Spectactular Chardonnay, so pure, clean and delicious. Defines the cool coastal climate of the Sonoma Coast, with brilliant, citrusy acidity brightening long hangtime flavors of tropical fruits, green apples and succulent peaches and pears. A stunningly good, upscale Chard to drink with very rich fare, such as ricotta cheese-filled gnocchi with grilled rock shrimp and Parmesan cheese.",Charles Heintz Vineyard,55,95, $0.58 ,California,Sonoma,"38.2918590, -122.4580356",38.291859,-122.4580356,Sonoma Coast,"38.5779555, -122.9888319",38.5779555,-122.9888319,Migration 2009 Charles Heintz Vineyard Chardonnay (Sonoma Coast),https://www.winemag.com/buying-guide/migration-2009-charles-heintz-vineyard-chardonnay-sonoma-coast/,Chardonnay,2009,Migration
winemag 7201 to 8000,12848,183619,14.5,White,US,"Chardonnays from this vineyard are virtually guaranteed to be among the richest in California, and Talley's 2008 certainly doesn't disappoint. It's a massively structured, flamboyant wine, tremendous in tropical fruit, pear, peach and apple flavors that taste like they've been baked into a pie, along with the sweet, smoky crust. A tremendous wine that must be paired with equally sized food. Lobster and scallops come to mind, served in rich cream and butter sauces.",Rosemary's Vineyard,46,95, $0.48 ,California,Central Coast,"35.6368759, -120.6545022",35.6368759,-120.6545022,Arroyo Grande Valley,"35.1443363, -120.5436230",35.1443363,-120.543623,Talley 2008 Rosemary's Vineyard Chardonnay (Arroyo Grande Valley),https://www.winemag.com/buying-guide/talley-2008-rosemarys-vineyard-chardonnay-central-coast-arroyo-grande-valley/,Chardonnay,2008,Talley
winemag 7201 to 8000,12849,183620,14.5,White,US,"A great Rincon Chardonnay, Talley's best ever. So rich and dramatically layered in pineapple tart, Meyer lemon custard, Key lime pie, golden apricot, mango and vanilla oak flavors, yet so briskly acidic and bright, with a firm minerality, like a lick of cold steel. Only 460 cases produced, but worth a special search.",Rincon Vineyard,42,95, $0.44 ,California,Central Coast,"35.6368759, -120.6545022",35.6368759,-120.6545022,Arroyo Grande Valley,"35.1443363, -120.5436230",35.1443363,-120.543623,Talley 2008 Rincon Vineyard Chardonnay (Arroyo Grande Valley),https://www.winemag.com/buying-guide/talley-2008-rincon-vineyard-chardonnay-central-coast-arroyo-grande-valley/,Chardonnay,2008,Talley
winemag 7201 to 8000,14205,184976,14.6,White,US,"Chardonnay doesn't get much riper or richer than this. Dazzles with pear jam, pineapple custard, crème brûlée, buttered toast and cinnamon spice flavors, and a firm grounding of minerals. Calls for the richest possible foods, like lobster. Drink now.",Courtney's Vineyard,55,95, $0.58 ,California,Central Coast,"35.6368759, -120.6545022",35.6368759,-120.6545022,Sta. Rita Hills,"34.6659565, -120.1152408",34.6659565,-120.1152408,Two Sisters 2008 Courtney's Vineyard Chardonnay (Sta. Rita Hills),https://www.winemag.com/buying-guide/two-sisters-2008-courtneys-vineyard-chardonnay-central-coast-sta-rita-hills/,Chardonnay,2008,Two Sisters
winemag 7201 to 8000,14206,184977,14.1,White,US,"An extraordinary Chardonnay whose complicated richness is balanced with tight acidity and a firm grounding of stony minerals. Brings to mind a great Chablis, with its zesty tang followed by elaborate layers of tropical fruits and pears. Utterly delicious, wildly appealing, a wine that will develop bottle interest over the next six years. Only 97 cases were produced.",Precioso,75,95, $0.79 ,California,Sonoma,"38.2918590, -122.4580356",38.291859,-122.4580356,Sonoma Coast,"38.5779555, -122.9888319",38.5779555,-122.9888319,Keller Estate 2007 Precioso Chardonnay (Sonoma Coast),https://www.winemag.com/buying-guide/keller-estate-2007-precioso-chardonnay-sonoma-coast/,Chardonnay,2007,Keller Estate
winemag 8001 to 8800,1158,187563,14.5,White,US,"An awesome Chardonnay that gives everything you want in richness, yet frames it in a structural integrity rare in California. Dazzles with tropical fruit, green apple and pear flavors, with a brilliant overlay of oak that adds buttered toast and spice flavors, not to mention sturdy oak tannins. But it's the zesty acidity, like a squirt of lime juice, that really elevates this wine.",Ulises Valdez Vineyard,70,95, $0.74 ,California,Sonoma,"38.2918590, -122.4580356",38.291859,-122.4580356,Russian River Valley,"38.9119799, -123.0537083",38.9119799,-123.0537083,Paul Hobbs 2008 Ulises Valdez Vineyard Chardonnay (Russian River Valley),https://www.winemag.com/buying-guide/paul-hobbs-2008-ulises-valdez-vineyard-chardonnay-sonoma-russian-river-valley/,Chardonnay,2008,Paul Hobbs
winemag 8001 to 8800,1172,187577,14.7,White,US,"It's easy to get ripe fruit in California and then plaster it in oak, but what's so difficult to achieve is the crisp, minerally structure this wine displays. It's rich in pineapple cream, Key lime pie, Meyer lemon sorbet, golden mango and vanilla oak flavors, but achieves balanced elegance with crisp acidity and a wonderful stony purity. Only 349 cases produced.",Proprietress Reserve,60,95, $0.63 ,California,Carneros,"38.2630002, -122.3415289",38.2630002,-122.3415289,Carneros,"38.2630002, -122.3415289",38.2630002,-122.3415289,Vine Cliff 2008 Proprietress Reserve Chardonnay (Carneros),https://www.winemag.com/buying-guide/vine-cliff-2008-proprietress-reserve-chardonnay-napa-sonoma-carneros/,Chardonnay,2008,Vine Cliff
winemag 8001 to 8800,5368,191773,15,White,US,"This is an intense, nervy Chardonnay, rich in acids and minerals that offer a tang to the palate. It's also dazzlingly rich, with complex flavors of pineapples, honeysuckle and buttered toast. Shows extraordinary concentration throughout the long, spicy finish.",Broken Road,55,95, $0.58 ,California,Sonoma,"38.2918590, -122.4580356",38.291859,-122.4580356,Alexander Valley,"38.6129647, -122.7694345",38.6129647,-122.7694345,Stonestreet 2008 Broken Road Chardonnay (Alexander Valley),https://www.winemag.com/buying-guide/stonestreet-2008-broken-road-chardonnay-sonoma-alexander-valley/,Chardonnay,2008,Stonestreet
winemag 8001 to 8800,6664,193069,13.5,White,US,"About as rich and flamboyant as California Chardonnay gets, a wine that blows you away with sheer pyrotechnic wizardry. Massive in grilled pineapples, mangoes, Key lime pie, vanilla honey, crème caramel and dusty spices, accented with perfect acidity.",Santa Barbara Historic Vineyards Collection Sanford & Benedict Vineyard,30,95, $0.32 ,California,Central Coast,"35.6368759, -120.6545022",35.6368759,-120.6545022,Santa Ynez Valley,"34.5841542, -120.0973685",34.5841542,-120.0973685,Au Bon Climat 2007 Santa Barbara Historic Vineyards Collection Sanford & Benedict Vineyard Chardonnay (Santa Ynez Valley),https://www.winemag.com/buying-guide/au-bon-climat-2007-santa-barbara-historic-collection-sanford-benedict-vineyard-chardonnay-central-coast-santa-ynez-valley/,Chardonnay,2007,Au Bon Climat
winemag 8001 to 8800,6665,193070,13.5,White,US,"Amazingly rich and ripe, defining the Bien Nacido cool-climate style. The grapes hung for a long time in this excellent vintage, getting ripe and balanced, and the wine offers dazzling opulence, while preserving vital acidity. Showcases dessert pastry flavors of pineapples, mangoes, buttered toast, buttercream, meringue and honeysuckle, accented with dusty spices. Simply beautiful from first sniff to the last swallow.",Santa Barbara Historic Vineyards Collection Bien Nacido Vineyard,30,95, $0.32 ,California,Central Coast,"35.6368759, -120.6545022",35.6368759,-120.6545022,Santa Maria Valley,"34.9530337, -120.4357191",34.9530337,-120.4357191,Au Bon Climat 2007 Santa Barbara Historic Vineyards Collection Bien Nacido Vineyard Chardonnay (Santa Maria Valley),https://www.winemag.com/buying-guide/au-bon-climat-2007-santa-barbara-historic-collection-bien-nacido-vineyard-chardonnay-central-coast-santa-maria-valley/,Chardonnay,2007,Au Bon Climat
winemag 8001 to 8800,6666,193071,14.4,White,US,"A best-of-barrels selection from the winery's various vineyards, this is a lush, intricate Chardonnay made in the modern style. It's fantastically rich in pineapple tart flavors, with the sweet, smoky crust, and more acidic citrus notes of Meyer lemons and limes. Oak aging and lees add fortunate layers of buttered toast and cream. Very intricate, with Chablisian dryness and minerality. Now-2014.",Diana's,55,95, $0.58 ,California,Central Coast,"35.6368759, -120.6545022",35.6368759,-120.6545022,Central Coast,"35.6368759, -120.6545022",35.6368759,-120.6545022,Testarossa 2008 Diana's Chardonnay (Central Coast),https://www.winemag.com/buying-guide/testarossa-2008-dianas-chardonnay-central-coast/,Chardonnay,2008,Testarossa
winemag 8001 to 8800,8194,194599,14.8,White,US,"Massive, opulent, oozing in pineapple créme brulée, honey, buttered toast and cinnamon spice flavors. Totally decadent, and fortunately set off with brisk, citrusy acidity. Calling all lobsters, and don't forget the drawn butter. Sheer hedonism in a glass, at a fantastic price.",,26,95, $0.27 ,California,Central Coast,"35.6368759, -120.6545022",35.6368759,-120.6545022,Sta. Rita Hills,"34.6659565, -120.1152408",34.6659565,-120.1152408,Melville 2008 Chardonnay (Sta. Rita Hills),https://www.winemag.com/buying-guide/melville-2008-chardonnay-central-coast-sta-rita-hills/,Chardonnay,2008,Melville
winemag 8001 to 8800,8200,194605,,White,US,"Massively fruity and oaky, this is an atom bomb of a Chardonnay. You either love this style or you hate it. The pineapple tart, apricot, pear, peach, crème brûlée, buttered toast, vanilla cream and cinnamon spice flavors go on and on. Beyond the utter richness is firm acidity and a bracing minerality. Defines California-style decadence, but drink now, as the wine will quickly go downhill.",Los Alamos Vineyard,25,95, $0.26 ,California,Central Coast,"35.6368759, -120.6545022",35.6368759,-120.6545022,Santa Barbara County,"34.4208305, -119.6981901",34.4208305,-119.6981901,Au Bon Climat 2007 Los Alamos Vineyard Chardonnay (Santa Barbara County),https://www.winemag.com/buying-guide/au-bon-climat-2007-los-alamos-vineyard-chardonnay-central-coast-santa-barbara-county/,Chardonnay,2007,Au Bon Climat
winemag 8001 to 8800,8207,194612,,White,US,"Massively rich, with pronounced, sweet, smoky oak flavors and a rich vein of tart, creamy lees highlighting the underlying fruity ripeness. Shows flavors of grilled pineapples, tropical mangoes and pears, balanced with crisp acids. Tremendously delicious and compelling.",Talley Rincon,38,95, $0.40 ,California,Central Coast,"35.6368759, -120.6545022",35.6368759,-120.6545022,Arroyo Grande Valley,"35.1443363, -120.5436230",35.1443363,-120.543623,Tantara 2007 Talley Rincon Chardonnay (Arroyo Grande Valley),https://www.winemag.com/buying-guide/tantara-2007-talley-rincon-chardonnay-central-coast-arroyo-grande-valley/,Chardonnay,2007,Tantara
winemag 8001 to 8800,8210,194615,14.8,White,US,"Amazingly rich, one of the most opulent Chardonnays you can drink now. Just wows the mouth with pineapple, pear, exotic tropical fruit, crème brûlée, vanilla custard, buttered toast and cinnamon spice flavors that go on and on through the finish. Also shows fine, tart acidity, which provides needed balance. Yes, it's superripe, but this is what California Chardonnay does at its best.",Allen Vineyard,50,95, $0.53 ,California,Sonoma,"38.2918590, -122.4580356",38.291859,-122.4580356,Russian River Valley,"38.9119799, -123.0537083",38.9119799,-123.0537083,Williams Selyem 2008 Allen Vineyard Chardonnay (Russian River Valley),https://www.winemag.com/buying-guide/williams-selyem-2008-allen-vineyard-chardonnay-sonoma-russian-river-valley/,Chardonnay,2008,Williams Selyem
winemag 8001 to 8800,9321,195726,14.3,White,US,"A small-production barrel selection from the estate vineyard, this fine wine is brilliantly rich and balanced, proving that Napa Valley can produce excellent Chardonnay. With pineapple, lemon, lime and buttered toast flavors, it's ultraclean in acidity and vibrant in minerals. While it's quite dry, it finishes with a rich flourish of honey.",Hope's Cuvee Estate Grown and Bottled,65,95, $0.68 ,California,Napa,"38.5024689, -122.2653887",38.5024689,-122.2653887,Napa Valley,"38.5024689, -122.2653887",38.5024689,-122.2653887,Signorello 2008 Hope's Cuvee Estate Grown and Bottled Chardonnay (Napa Valley),https://www.winemag.com/buying-guide/signorello-2008-hopes-cuvee-estate-grown-bottled-chardonnay-napa-valley/,Chardonnay,2008,Signorello
winemag 8001 to 8800,9326,195731,14.3,White,US,"Don't drink this beauty too cold with your lobster, crab or scallops. It has the weight of a noble wine, with minerality and creaminess giving shape and texture to the leesy, yeasty flavors of pineapples, Key lime pie and ripe pear purée. Aged in 40% new French oak, California Chardonnay hardly gets any better than this.",Ashley's Vineyard,28,95, $0.29 ,California,Central Coast,"35.6368759, -120.6545022",35.6368759,-120.6545022,Sta. Rita Hills,"34.6659565, -120.1152408",34.6659565,-120.1152408,Fess Parker 2008 Ashley's Vineyard Chardonnay (Sta. Rita Hills),https://www.winemag.com/buying-guide/fess-parker-2008-ashleys-vineyard-chardonnay-central-coast-sta-rita-hills/,Chardonnay,2008,Fess Parker
winemag 8001 to 8800,13080,199485,13.5,White,US,"A massively constructed Chardonnay that's opulent and concentrated and bursts in the mouth with pineapple, lemon drop candy, Asian pear and white peach flavors of enormous ripeness. The entire production of 108 cases was aged in new oak, so there's a lavish veneer of sweet, smoky buttered toast. Sur lie aging is evident in the creaminess and ever so slight sourdough tartness that adds a piquant touch. This impressive Chard is at its best now in its flashy, flamboyant youth.",Pastorale Vineyard,100,95, $1.05 ,California,Sonoma,"38.2918590, -122.4580356",38.291859,-122.4580356,Sonoma Coast,"38.5779555, -122.9888319",38.5779555,-122.9888319,Freestone 2007 Pastorale Vineyard Chardonnay (Sonoma Coast),https://www.winemag.com/buying-guide/freestone-2007-pastorale-vineyard-chardonnay-sonoma-coast/,Chardonnay,2007,Freestone
winemag 8001 to 8800,14146,200551,14.8,White,US,"Very powerful, very strong, almost overwhelming in the sheer wealth of fruit and oak, but balanced with acidity. Winemaker Bob Cabral himself calls it ""concentrated."" It detonates on the palate with an almost dessert wine quality of lemons, pineapples, honey, vanilla and minerals, but it's totally dry. Will hold for perhaps six years.",Hawk Hill Vineyard,50,95, $0.53 ,California,Sonoma,"38.2918590, -122.4580356",38.291859,-122.4580356,Russian River Valley,"38.9119799, -123.0537083",38.9119799,-123.0537083,Williams Selyem 2007 Hawk Hill Vineyard Chardonnay (Russian River Valley),https://www.winemag.com/buying-guide/williams-selyem-2007-hawk-hill-vineyard-chardonnay-sonoma-russian-river-valley/,Chardonnay,2007,Williams Selyem
winemag 801 to 1600,239,202282,14.1,White,US,"This gorgeous white has a density and weight to it that never becomes heavy, instead remaining complex and steely in character. Wet stone, apricot and key lime intermingle effortlessly around a core of balanced richness and supportive acidity, the oak well-integrated and nuanced.",Durell Vineyard,80,95, $0.84 ,California,Sonoma,"38.2918590, -122.4580356",38.291859,-122.4580356,Sonoma Coast,"38.5779555, -122.9888319",38.5779555,-122.9888319,Kistler 2015 Durell Vineyard Chardonnay (Sonoma Coast),https://www.winemag.com/buying-guide/kistler-2015-durell-vineyard-chardonnay-sonoma-coast/,Chardonnay,2015,Kistler
